"Index","Title description","Price","N_rooms","Surface","N_toilettes","Floor"
"1414","Trilocale via Nomentana, Africano - Villa Chigi, Roma","1600.0","3","60.0","nan","4"
"1415","Villa a schiera via Isocrate 46, Casal Palocco, Roma","2000.0","5+","238.0","3+","4"
"1416","Appartamento via dei Monti Parioli, Euclide, Roma","5800.0","5+","390.0","3","4"
"1417","Trilocale ottimo stato, terzo piano, Monteverde Nuovo, Roma","1300.0","3","80.0","nan","4"
"1418","Appartamento via Passignano sul Trasimeno, Fleming, Roma","2300.0","5+","184.0","3","4"
"1419","Quadrilocale salita del grillo, Monti, Roma","3300.0","4","160.0","2","4"
"1420","Bilocale via Casilina 559B, Tor de' Schiavi, Roma","900.0","2","75.0","nan","4"
"1421","Appartamento via Catanzaro, Bologna, Roma","1500.0","5","110.0","2","4"
"1422","Bilocale via di Torre Rossa 35, Gregorio VII - Piccolomini, Roma","900.0","2","70.0","nan","4"
"1423","Monolocale via Raimondo Montecuccoli, Pigneto, Roma","600.0","nan","25.0","nan","4"
"1424","Quadrilocale via Giovanni Angelini, Portuense, Roma","1800.0","4","152.0","2","4"
"1425","Trilocale via prospero santacroce, Boccea, Roma","1000.0","3","87.0","nan","4"
"1426","Bilocale ottimo stato, su più livelli, Via Giulia, Roma","739.0","2","30.0","nan","1"
"1427","Trilocale via Pietro Castrucci, Infernetto, Roma","700.0","3","75.0","nan","1"
"1428","Bilocale via dei Virgulti 48, Centocelle, Roma","800.0","2","75.0","nan","1"
"1429","Quadrilocale buono stato, secondo piano, Pinciano - Villa Ada, Roma","6500.0","4","290.0","3+","1"
"1430","Trilocale via Lucio Trebellio, Anagnina, Roma","750.0","3","70.0","nan","1"
"1431","Appartamento in villa via Pieve di Cadore 30, Cortina d'Ampezzo, Roma","4950.0","5+","390.0","3+","1"
"1432","Bilocale via Tiberio Imperatore 45, San Paolo, Roma","850.0","2","77.0","nan","1"
"1433","Bilocale via Homs, Africano - Villa Chigi, Roma","950.0","2","45.0","nan","1"
"1434","Villa bifamiliare via Galloro, Quarto Miglio, Roma","2500.0","5+","240.0","3+","1"
"1435","Attico via del Fosso di Santa Maura, Cinecittà, Roma","800.0","2","50.0","nan","1"
"1436","Trilocale piazza Ragusa 47, Villa Fiorelli, Roma","1100.0","3","86.0","nan","1"
"1437","Appartamento via Franco Simongini, Talenti - Monte Sacro, Roma","800.0","nan","70.0","nan","1"
"1438","Bilocale via Enrico Carano 23, Centocelle, Roma","750.0","2","50.0","nan","1"
"1439","Bilocale via Attilio Micheluzzi 8, Mezzocammino, Roma","900.0","2","55.0","nan","1"
"1440","Quadrilocale via Giuseppe Lorenzoni 9, Cecchignola - Giuliano Dalmata, Roma","1300.0","4","138.0","2","1"
"1441","Quadrilocale via Urbana, Monti, Roma","3200.0","4","125.0","nan","1"
"1442","Trilocale piazza Jan Palach 36, Villaggio Olimpico, Roma","1350.0","3","95.0","nan","1"
"1443","Trilocale via Federico Paolini, Ostia Levante, Roma","1100.0","3","90.0","nan","1"
"1444","Bilocale via Renato Caccioppoli, Castel di Leva, Roma","700.0","2","48.0","nan","1"
"1445","Attico lungomare Paolo Toscanelli, Ostia Levante, Roma","3000.0","3","90.0","3","1"
"1446","Trilocale viale Furio Camillo, Furio Camillo, Roma","1300.0","3","130.0","nan","1"
"1447","Monolocale via Mondovì, Re di Roma, Roma","850.0","nan","40.0","nan","1"
"1448","Appartamento via Nomentana 248, Bologna, Roma","2900.0","5","182.0","3","1"
"1449","Bilocale via Copenaghen 39, Torrino, Roma","1200.0","2","70.0","nan","1"
"1450","Trilocale via Leonida Repaci, Bufalotta, Roma","1100.0","3","90.0","2","1"
"1451","Villa bifamiliare via Motta d'Affermo 3, Borghesiana, Roma","1100.0","4","100.0","2","3"
"1452","Trilocale via di Torrevecchia 297, Torrevecchia, Roma","1000.0","3","82.0","nan","3"
"1453","Villa a schiera Strada C, Olgiata, Roma","2500.0","4","270.0","3","3"
"1454","Quadrilocale via Lago di Lesina, Africano - Villa Chigi, Roma","2100.0","4","155.0","2","3"
"1455","Bilocale corso di Francia 163, Vigna Clara - Vigna Stelluti, Roma","800.0","2","70.0","nan","3"
"1456","Trilocale via di Grottarossa 1262, Grottarossa - Saxa Rubra, Roma","1600.0","3","199.0","2","3"
"1457","Attico via Angelo Di Pietro, Gregorio VII - Piccolomini, Roma","1300.0","2","81.0","2","3"
"1458","Appartamento via Bartolomeo Eustachio, Policlinico, Roma","2300.0","5","135.0","2","3"
"1459","Bilocale via Veientana 37, Grottarossa - Saxa Rubra, Roma","790.0","2","70.0","nan","3"
"1460","Attico via Piediluco, Trieste - Coppedè, Roma","2650.0","3","110.0","2","3"
"1461","Quadrilocale via Baldo degli Ubaldi, Baldo degli Ubaldi, Roma","1300.0","4","135.0","2","3"
"1462","Bilocale largo dell'Olgiata 15, Olgiata, Roma","1600.0","2","55.0","nan","3"
"1463","Attico via di Monserrato, Via Giulia, Roma","4000.0","3","130.0","2","3"
"1464","Appartamento viale Vaticano, Cipro, Roma","3500.0","5","100.0","2","3"
"1465","Trilocale via dei Cestari, Pantheon, Roma","1900.0","3","90.0","nan","3"
"1466","Villa a schiera via Cassia 1866, La Storta, Roma","1300.0","3","100.0","2","3"
"1467","Quadrilocale piazza dei Navigatori , 23, Navigatori, Roma","1290.0","4","110.0","nan","3"
"1468","Trilocale via Tommaso Piroli 20, Giardinetti, Roma","900.0","3","65.0","nan","3"
"1469","Trilocale via delle Canarie 76, Ostia Ponente, Roma","790.0","3","78.0","2","3"
"1470","Bilocale via Sestio Calvino, Cinecittà, Roma","900.0","2","62.0","nan","3"
"1471","Bilocale corso Duca di Genova, Ostia Ponente, Roma","650.0","2","70.0","nan","3"
"1472","Bilocale piazza dei Re di Roma, Re di Roma, Roma","1100.0","2","60.0","nan","3"
"1473","Appartamento via Cheren, Africano - Villa Chigi, Roma","1300.0","5+","107.0","2","3"
"1474","Appartamento via Tomba di Nerone, Tomba di Nerone, Roma","4000.0","5+","308.0","3+","3"
"1475","Trilocale via di Novella, Africano - Villa Chigi, Roma","1350.0","3","100.0","nan","3"
"1476","Bilocale via di Acilia 221, Acilia, Roma","700.0","2","50.0","nan","6"
"1477","Trilocale via del Trifoglio 43, Centocelle, Roma","1000.0","3","100.0","nan","6"
"1478","Bilocale via Giuseppe Vasi, Bologna, Roma","830.0","2","50.0","nan","6"
"1479","Bilocale via Adalberto, Bologna, Roma","990.0","2","50.0","nan","6"
"1480","Attico via Misurina, Cortina d'Ampezzo, Roma","6000.0","5","160.0","2","6"
"1481","Trilocale via dei Marrucini 8, San Lorenzo, Roma","1050.0","3","66.0","nan","6"
"1482","Trilocale viale Regina Margherita 217, Trieste - Coppedè, Roma","2000.0","3","85.0","nan","6"
"1483","Trilocale via Prenestina, Villa Gordiani, Roma","900.0","3","100.0","nan","6"
"1484","Appartamento via di San Sebastianello, Spagna, Roma","6500.0","5+","255.0","3","6"
"1485","Appartamento in villa via Galloro, Quarto Miglio, Roma","1700.0","5+","208.0","3+","6"
"1486","Quadrilocale via delle Case Basse 195, Centro Giano, Roma","1300.0","4","180.0","2","6"
"1487","Bilocale via Lucrino 47, Africano - Villa Chigi, Roma","1200.0","2","40.0","nan","6"
"1488","Bilocale via Ruggero Fauro, Parioli, Roma","1200.0","2","71.0","nan","6"
"1489","Trilocale via Andrea Solario, Tintoretto, Roma","1300.0","3","123.0","2","6"
"1490","Trilocale ottimo stato, ottavo piano, Furio Camillo, Roma","1400.0","3","92.0","nan","6"
"1491","Appartamento via Mar della Cina, Torrino, Roma","2100.0","5+","165.0","2","6"
"1492","Attico via degli Orti Flaviani, Ardeatino - Montagnola, Roma","3900.0","5","200.0","3","6"
"1493","Attico via Castel Sant'Elia 11, Ponte Milvio, Roma","1350.0","2","84.0","nan","6"
"1494","Villa plurifamiliare viale Gorgia di Leontini, Casal Palocco, Roma","1800.0","5+","145.0","3","6"
"1495","Attico corso d'Italia, Pinciano - Villa Ada, Roma","3700.0","5+","140.0","3","6"
"1496","Quadrilocale via Valle della Storta 86, La Storta, Roma","750.0","4","70.0","2","6"
"1497","Trilocale via Antonio Pollaiolo, Parioli, Roma","2300.0","3","100.0","2","6"
"1498","Quadrilocale piazza Campo Marzio, Montecitorio, Roma","5000.0","4","204.0","2","6"
"1499","Attico via Vittoria, Spagna, Roma","8000.0","5+","150.0","2","6"
"1500","Appartamento viale Liegi, Pinciano - Villa Ada, Roma","2500.0","5","182.0","3","6"
"1501","Trilocale via Trebio Littore 16, Monteverde Vecchio, Roma","1500.0","3","110.0","2","1"
"1502","Bilocale via Antonio Coppi, Appio Latino, Roma","1250.0","2","65.0","nan","1"
"1503","Quadrilocale via Salvatore Pincherle 195, Marconi, Roma","1200.0","4","110.0","nan","1"
"1504","Villa unifamiliare largo dell'Olgiata 15, Olgiata, Roma","nan","5+","700.0","3+","1"
"1505","Attico via Cesare De Lollis, San Lorenzo, Roma","1800.0","3","52.0","nan","1"
"1506","Trilocale via Giuseppe Renato Bellot, Castel Fusano, Roma","750.0","3","64.0","nan","1"
"1507","Bilocale via della Balduina, Balduina, Roma","950.0","2","60.0","nan","1"
"1508","Trilocale via Panama 110, Pinciano - Villa Ada, Roma","1600.0","3","90.0","2","1"
"1509","Attico buono stato, 200 m², La Giustiniana, Roma","3500.0","5+","200.0","3","1"
"1510","Bilocale via dei Casali delle Cornacchiole 175, Torricola - Tor Carbone, Roma","800.0","2","120.0","nan","1"
"1511","Quadrilocale via dei Coribanti, Torre Angela, Roma","1200.0","4","100.0","nan","1"
"1512","Trilocale piazza della Radio, Marconi, Roma","1100.0","3","75.0","nan","1"
"1513","Trilocale via Mar della Cina, Torrino, Roma","1250.0","3","113.0","2","1"
"1514","Quadrilocale via Antonio Bosio 28, Bologna, Roma","1900.0","4","95.0","2","1"
"1515","Villa unifamiliare via di Vallerano, Vallerano, Roma","4000.0","5+","365.0","3+","1"
"1516","Quadrilocale via Alessandro Poerio, Monteverde Vecchio, Roma","1900.0","4","95.0","2","1"
"1517","Villa unifamiliare viale del Museo Borghese, Parioli, Roma","3000.0","5+","300.0","3+","1"
"1518","Trilocale piazza di Porta San Giovanni, San Giovanni, Roma","1250.0","3","75.0","nan","1"
"1519","Trilocale buono stato, terzo piano, Monti, Roma","1600.0","3","90.0","nan","1"
"1520","Appartamento viale Cesare Pavese, Fonte Ostiense, Roma","1400.0","5","130.0","2","1"
"1521","Bilocale via degli Zingari, Monti, Roma","1500.0","2","65.0","nan","1"
"1522","Appartamento via Giacomo Puccini 10, Pinciano - Villa Ada, Roma","6500.0","5+","150.0","3+","1"
"1523","Monolocale via Boncompagni, Sallustiano, Roma","800.0","nan","35.0","nan","1"
"1524","Trilocale corso Duca di Genova, Ostia Ponente, Roma","1000.0","3","110.0","nan","1"
"1525","Quadrilocale largo Damiano Chiesa, Balduina, Roma","1800.0","4","140.0","2","1"
"1526","Bilocale via Budapest 6, Torrino, Roma","1000.0","2","47.0","nan","4"
"1527","Trilocale piazza della Balduina, Balduina, Roma","1250.0","3","100.0","2","4"
"1528","Bilocale via San Calepodio 19, Monteverde Vecchio, Roma","3000.0","2","77.0","2","4"
"1529","Trilocale via Urbana 120, Monti, Roma","1850.0","3","85.0","2","4"
"1530","Quadrilocale via Ximenes, Euclide, Roma","2200.0","4","136.0","2","4"
"1531","Trilocale via Enea 47, Furio Camillo, Roma","1100.0","3","85.0","nan","4"
"1532","Bilocale via Alfredo Catalani 31, Africano - Villa Chigi, Roma","1300.0","2","110.0","nan","4"
"1533","Trilocale via delle Antille, Ostia Ponente, Roma","900.0","3","114.0","2","4"
"1534","Trilocale via Cassia 2070, Olgiata, Roma","800.0","3","65.0","nan","4"
"1535","Bilocale viale di Castel Porziano 430, Infernetto, Roma","660.0","2","42.0","nan","4"
"1536","Trilocale via Flaminia, 798, Fleming, Roma","1100.0","3","90.0","nan","4"
"1537","Trilocale via Carlo Giuseppe Bertero, Talenti - Monte Sacro, Roma","770.0","3","93.0","2","4"
"1538","Trilocale via di Vigna Fabbri 12, Appio Latino, Roma","1400.0","3","80.0","nan","4"
"1539","Bilocale via Nicola da Guardiagrele, Giardinetti, Roma","700.0","2","50.0","nan","4"
"1540","Attico via Sandro Giovannini, Casal Boccone, Roma","1850.0","4","200.0","2","4"
"1541","Attico via Giacomo Giri 7, Baldo degli Ubaldi, Roma","950.0","nan","55.0","nan","4"
"1542","Appartamento via 20 Settembre 49, Sallustiano, Roma","3500.0","5+","180.0","nan","4"
"1543","Quadrilocale ottimo stato, secondo piano, Fleming, Roma","2600.0","4","176.0","3","4"
"1544","Quadrilocale via Lungotevere Dei Mellini 7, Prati, Roma","1800.0","4","310.0","3+","4"
"1545","Bilocale via Sardegna 29, Vittorio Veneto, Roma","3650.0","2","45.0","nan","4"
"1546","Bilocale via via Aurora 31, Vittorio Veneto, Roma","5150.0","2","70.0","2","4"
"1547","Trilocale via Galvani 33B, Testaccio, Roma","4100.0","3","65.0","2","4"
"1548","Trilocale via Alessandro Minuziano 57, Trigoria, Roma","750.0","3","53.0","nan","4"
"1549","Trilocale via del Padiglione 69, Borghesiana, Roma","1000.0","3","70.0","nan","4"
"1550","Villa bifamiliare largo dell'Olgiata 15, Olgiata, Roma","2250.0","4","130.0","2","4"
"1551","Quadrilocale Lungotevere di Pietra Papa 63, Marconi, Roma","1300.0","4","140.0","2","4"
"1552","Appartamento via Mario Cora, Borghesiana, Roma","1900.0","5+","180.0","2","4"
"1553","Trilocale via della cappelletta della Giustiniana, La Giustiniana, Roma","900.0","3","90.0","nan","4"
"1554","Trilocale viale Città d'Europa, Torrino, Roma","1800.0","3","115.0","2","4"
"1555","Bilocale via di Santa Maria Ausiliatrice, Furio Camillo, Roma","900.0","2","55.0","nan","4"
"1556","Monolocale via Alfredo Grandidier, Castel di Leva, Roma","500.0","nan","30.0","nan","4"
"1557","Quadrilocale piazza Mattei, Ghetto - Portico d'Ottavia, Roma","3000.0","4","126.0","3","4"
"1558","Trilocale via Margutta, Spagna, Roma","nan","3","120.0","3","4"
"1559","Quadrilocale via Catanzaro, Bologna, Roma","1900.0","4","100.0","2","4"
"1560","Trilocale via Magnagrecia, San Giovanni, Roma","1200.0","3","85.0","2","4"
"1561","Quadrilocale viale dei quattro venti, Monteverde Vecchio, Roma","1500.0","4","90.0","2","4"
"1562","Appartamento via Cassia 900, Tomba di Nerone, Roma","2500.0","5","200.0","2","4"
"1563","Quadrilocale via Giuseppe Perego, Mostacciano, Roma","2100.0","4","165.0","2","4"
"1564","Bilocale via del Casale di San Basilio, Ponte Mammolo, Roma","650.0","2","55.0","2","4"
"1565","Trilocale piazza dei Prati degli Strozzi, Mazzini - Delle Vittorie, Roma","1650.0","3","80.0","2","4"
"1566","Trilocale viale dello Scalo San Lorenzo, San Lorenzo, Roma","1400.0","3","100.0","2","4"
"1567","Attico via Vedana, Ardeatino - Montagnola, Roma","1500.0","3","120.0","nan","4"
"1568","Quadrilocale via Poggio Ameno, Ardeatino - Montagnola, Roma","1800.0","4","145.0","2","4"
"1569","Quadrilocale via Vincenzo Picardi, Parioli, Roma","1790.0","4","120.0","2","4"
"1570","Quadrilocale via Gregorio VII 132, Gregorio VII - Piccolomini, Roma","1600.0","4","135.0","nan","4"
"1571","Trilocale via di Sant'Angelo in Pescheria 6, Ghetto - Portico d'Ottavia, Roma","3100.0","3","90.0","2","4"
"1572","Trilocale Circonvallazione Clodia, Mazzini - Delle Vittorie, Roma","1350.0","3","80.0","nan","4"
"1573","Trilocale via del Fringuello 3, Tor Tre Teste - Torre Maura, Roma","1000.0","3","90.0","nan","4"
"1574","Quadrilocale via Cassia 1219, La Storta, Roma","1700.0","4","180.0","2","4"
"1575","Quadrilocale via Sergio Forti, Mostacciano, Roma","2400.0","4","147.0","2","4"
"1576","Trilocale via di Torre Gaia, Torre Gaia, Roma","900.0","3","91.0","2","1"
"1577","Monolocale via Emilio Longoni 19/21, Tor Sapienza - La Rustica, Roma","600.0","nan","40.0","nan","1"
"1578","Monolocale via Boncompagni, Sallustiano, Roma","800.0","nan","35.0","nan","1"
"1579","Villa unifamiliare piazzale Flaminio 22, Flaminio, Roma","8000.0","5","150.0","3","1"
"1580","Bilocale via di Acilia 221, Acilia, Roma","850.0","2","65.0","nan","1"
"1581","Trilocale via Caio Mario 7, Prati, Roma","1600.0","3","90.0","nan","1"
"1582","Quadrilocale via Filippo Maria Pirelli, Gregorio VII - Piccolomini, Roma","2000.0","4","200.0","3","1"
"1583","Attico via Montefiorino 61, Labaro, Roma","980.0","4","90.0","2","1"
"1584","Trilocale via Raffaello Arcangelo Salimbeni, Mezzocammino, Roma","1100.0","3","70.0","nan","1"
"1585","Bilocale via Primo Acciaresi 8, Pietralata, Roma","850.0","2","85.0","nan","1"
"1586","Attico via Giuseppe Silla, 30, La Giustiniana, Roma","1100.0","3","85.0","nan","1"
"1587","Trilocale ottimo stato, piano terra, Torrevecchia, Roma","850.0","3","65.0","nan","1"
"1588","Bilocale via Ruggero Fiore, Cipro, Roma","1200.0","2","60.0","nan","1"
"1589","Villa a schiera largo dell'Olgiata 15, Olgiata, Roma","2800.0","5+","245.0","3","1"
"1590","Bilocale via Sabino Longone, Grottarossa - Saxa Rubra, Roma","600.0","2","45.0","nan","1"
"1591","Monolocale via Casilina, 9, San Giovanni, Roma","850.0","nan","58.0","nan","1"
"1592","Appartamento via Soana, Re di Roma, Roma","2800.0","5+","240.0","2","1"
"1593","Quadrilocale via Cola di Rienzo, Prati, Roma","3000.0","4","136.0","2","1"
"1594","Trilocale via della Palmarola, 174, Ottavia, Roma","790.0","3","90.0","nan","1"
"1595","Appartamento viale Giuseppe Mazzini, Mazzini - Delle Vittorie, Roma","5600.0","5+","320.0","3","1"
"1596","Monolocale via Tommaso Salvini, Parioli, Roma","1200.0","nan","30.0","nan","1"
"1597","Trilocale via Trecate, Casalotti, Roma","750.0","3","60.0","nan","1"
"1598","Quadrilocale via Pietro Cossa, Prati, Roma","2800.0","4","160.0","2","1"
"1599","Trilocale via del Casale di San Basilio, Ponte Mammolo, Roma","750.0","3","72.0","nan","1"
"1600","Trilocale via Romeo Rodriguez Pereira, Balduina, Roma","1250.0","3","80.0","nan","1"
"1601","Bilocale via Guido Banti, Fleming, Roma","1000.0","2","85.0","nan","0"
"1602","Trilocale via Albalonga, Roma","1089.0","3","75.0","2","0"
"1603","Trilocale via Anagnina 491, Morena, Roma","990.0","3","90.0","2","0"
"1604","Bilocale piazzale Jonio 50, Tufello, Roma","1000.0","2","70.0","nan","0"
"1605","Villa plurifamiliare via Torcegno, Infernetto, Roma","1600.0","4","188.0","3","0"
"1606","Trilocale via Pietro Baragiola, Tor Vergata, Roma","750.0","3","73.0","nan","0"
"1607","Quadrilocale via Ortucchio, Case Rosse, Roma","1200.0","4","140.0","nan","0"
"1608","Trilocale largo Gerolamo Belloni, Vigna Clara - Vigna Stelluti, Roma","1330.0","3","83.0","nan","0"
"1609","Trilocale via Sirio Corbari, Cinecittà, Roma","850.0","3","95.0","2","0"
"1610","Quadrilocale viale Ronchi, Villa Gordiani, Roma","1100.0","4","100.0","nan","0"
"1611","Bilocale via Ernesto Basile 69, Mezzocammino, Roma","650.0","2","35.0","nan","0"
"1612","Quadrilocale via dei Serpenti, Monti, Roma","2700.0","4","120.0","2","0"
"1613","Villa unifamiliare via del Fosso della Castelluccia, Castel di Leva, Roma","nan","5+","600.0","3+","0"
"1614","Trilocale via della Caffarelletta 41, Appio Latino, Roma","1150.0","3","75.0","nan","0"
"1615","Trilocale via Telegono, Quadraro, Roma","1200.0","3","103.0","nan","0"
"1616","Quadrilocale via Giovanni Giolitti, Esquilino, Roma","1690.0","4","145.0","nan","0"
"1617","Quadrilocale via Bari, Policlinico, Roma","1700.0","4","106.0","2","0"
"1618","Monolocale via Casilina 529, Tor de' Schiavi, Roma","500.0","nan","25.0","2","0"
"1619","Palazzo - Edificio via Carciano 49, Settecamini, Roma","2800.0","5+","5.012","3+","0"
"1620","Bilocale via Alberobello, Torre Angela, Roma","700.0","2","70.0","nan","0"
"1621","Mansarda via Ildebrando Vivanti, Mostacciano, Roma","900.0","2","65.0","nan","0"
"1622","Trilocale via al Sesto Miglio, 52, Tomba di Nerone, Roma","1000.0","3","90.0","nan","0"
"1623","Bilocale ottimo stato, piano terra, Fleming, Roma","1200.0","2","65.0","nan","0"
"1624","Villa unifamiliare, buono stato, 716 m², San Saba - Caracalla, Roma","1350.0","5+","716.0","3+","0"
"1625","Villa unifamiliare via Teheran, Camilluccia - Farnesina, Roma","3000.0","5+","600.0","3+","0"
"1626","Quadrilocale via Messina, Salario - Porta Pia, Roma","2500.0","4","120.0","3","2"
"1627","Quadrilocale via Padre Semeria 65, Garbatella, Roma","1500.0","4","120.0","2","2"
"1628","Appartamento via Del Colosseo, Colle Oppio, Roma","8000.0","5","150.0","3","2"
"1629","Trilocale via de Cosmi Giovanni Agostino, Monte Mario - Trionfale, Roma","1000.0","3","90.0","nan","2"
"1630","Bilocale via carezzano 136, Casal Selce, Roma","650.0","2","40.0","nan","2"
"1631","Bilocale via Emanuele Filiberto, Esquilino, Roma","1500.0","2","55.0","nan","2"
"1632","Attico via Nicolò Piccinni, Africano - Villa Chigi, Roma","2100.0","3","90.0","2","2"
"1633","Bilocale viale dei Quattro Venti, Monteverde Vecchio, Roma","1150.0","2","56.0","nan","2"
"1634","Appartamento via Firenze, Repubblica, Roma","3590.0","5","200.0","3","2"
"1635","Quadrilocale via Nomentana 253, Trieste - Coppedè, Roma","1900.0","4","140.0","nan","2"
"1636","Mansarda viale delle Mura Aurelie, Gregorio VII - Piccolomini, Roma","900.0","2","70.0","nan","2"
"1637","Villa unifamiliare via di Torre Gaia, Torre Gaia, Roma","3200.0","5+","150.0","3+","2"
"1638","Trilocale via della Meloria, Cipro, Roma","1390.0","3","88.0","nan","2"
"1639","Trilocale via Generale Roberto Bencivenga 32, Città Giardino, Roma","1500.0","3","100.0","nan","2"
"1640","Trilocale via Panisperna, Monti, Roma","2000.0","3","70.0","nan","2"
"1641","Attico via di Villa Ruffo 5, Flaminio, Roma","6500.0","5","186.0","3","2"
"1642","Bilocale buono stato, piano terra, Colli Portuensi - Casaletto, Roma","1200.0","2","70.0","nan","2"
"1643","Quadrilocale Lungotevere Dei Mellini, Prati, Roma","2400.0","4","160.0","2","2"
"1644","Attico via Romeo Rodriguez Pereira 129, Balduina, Roma","1950.0","4","155.0","2","2"
"1645","Bilocale via Carlo Ludovico Bragaglia, Porta di Roma, Roma","750.0","2","44.0","nan","2"
"1646","Attico via del Gesù, Pantheon, Roma","8500.0","5+","267.0","3+","2"
"1647","Quadrilocale via di Santa Melania, Aventino, Roma","2500.0","4","135.0","2","2"
"1648","Villa unifamiliare viale Vaticano, Cipro, Roma","2200.0","5+","280.0","3+","2"
"1649","Trilocale via Sinuessa 14, San Giovanni, Roma","950.0","3","85.0","nan","2"
"1650","Monolocale via Cheren 12, Africano - Villa Chigi, Roma","800.0","nan","25.0","nan","2"
"1651","Trilocale via Pietro Tacchini 29, Euclide, Roma","1900.0","3","85.0","2","R"
"1652","Quadrilocale piazza Tolosetto Farinata degli Uberti, Ostia Levante, Roma","900.0","4","135.0","nan","R"
"1653","Trilocale via Flavia, Sallustiano, Roma","2000.0","3","90.0","2","R"
"1654","Bilocale via dei Genieri 133, Cecchignola - Giuliano Dalmata, Roma","650.0","2","70.0","nan","R"
"1655","Quadrilocale via Simone De Saint Bon 18, Mazzini - Delle Vittorie, Roma","1100.0","4","76.0","2","R"
"1656","Trilocale via di Villa Emiliani, Parioli, Roma","1400.0","3","60.0","nan","R"
"1657","Trilocale ottimo stato, primo piano, Valle Muricana, Roma","850.0","3","78.0","2","R"
"1658","Trilocale via Roccaporena, Fleming, Roma","1300.0","3","78.0","nan","R"
"1659","Bilocale vicolo dei Panieri 2, Trastevere, Roma","1750.0","2","77.0","nan","R"
"1660","Bilocale via Asmara 31, Africano - Villa Chigi, Roma","4250.0","2","55.0","nan","R"
"1661","Bilocale nuovo, piano terra, Via Giulia, Roma","699.0","2","30.0","nan","R"
"1662","Trilocale vicolo Domizio, Piazza Navona, Roma","1550.0","3","82.0","2","R"
"1663","Quadrilocale viale Alessandro Manzoni, Esquilino, Roma","2100.0","4","120.0","2","R"
"1664","Appartamento viale Cortina d'Ampezzo, Cortina d'Ampezzo, Roma","1400.0","5","140.0","2","R"
"1665","Villa unifamiliare viale Aventino 53, San Saba - Caracalla, Roma","nan","5+","1.0","3+","R"
"1666","Villa unifamiliare via FOSSO DELLA CASTELLUCCIA, Castel di Leva, Roma","3000.0","4","280.0","3+","R"
"1667","Attico via Clitunno, Trieste - Coppedè, Roma","4600.0","5+","196.0","2","R"
"1668","Quadrilocale ottimo stato, quarto piano, Via Giulia, Roma","2700.0","4","143.0","2","R"
"1669","Bilocale via Cesare Balbo, Monti, Roma","330.0","2","8.0","nan","R"
"1670","Bilocale vicolo Savelli, Piazza Navona, Roma","1550.0","2","50.0","nan","R"
"1671","Trilocale via Clelia Garofolini 4, Colli Portuensi - Casaletto, Roma","1500.0","3","103.0","2","R"
"1672","Appartamento via Vittorio Veneto 136, Vittorio Veneto, Roma","7000.0","5","250.0","3","R"
"1673","Villa unifamiliare largo dell'Olgiata 15, Olgiata, Roma","nan","5","450.0","3+","R"
"1674","Bilocale via dei Prati dei Papa 7L, Marconi, Roma","850.0","2","70.0","nan","R"
"1675","Quadrilocale via Mantova, Salario - Porta Pia, Roma","2000.0","4","120.0","2","R"
"1676","Attico viale Gorizia 25C, Trieste - Coppedè, Roma","3300.0","5+","236.0","2","5"
"1677","Appartamento via Nomentana 248, Bologna, Roma","3500.0","5","220.0","3","5"
"1678","Bilocale via Elio Chianesi 115, Mostacciano, Roma","780.0","2","43.0","nan","5"
"1679","Trilocale via Antonio Silvani, Nuovo Salario, Roma","1100.0","3","110.0","2","5"
"1680","Villa plurifamiliare via Stesicoro, Axa, Roma","1300.0","4","130.0","3","5"
"1681","Appartamento via Fulvio Tomassucci, Mostacciano, Roma","3000.0","5+","198.0","3","5"
"1682","Bilocale via Giuseppe Giacosa 18, Talenti - Monte Sacro, Roma","900.0","2","58.0","nan","5"
"1683","Trilocale vicolo del Governo Vecchio 54, Piazza Navona, Roma","2200.0","3","81.0","nan","5"
"1684","Attico via Domenico de Dominicis 26, Casal Bertone, Roma","1400.0","2","48.0","nan","5"
"1685","Bilocale via di Propaganda, Spagna, Roma","1650.0","2","95.0","nan","5"
"1686","Appartamento via Cassia 531, Cassia - San Godenzo, Roma","3500.0","5+","234.0","3","5"
"1687","Trilocale via Latina 284, Appio Latino, Roma","1300.0","3","75.0","2","5"
"1688","Attico via Clitunno 12, Trieste - Coppedè, Roma","1400.0","2","65.0","nan","5"
"1689","Trilocale via Luigi Mancinelli, Africano - Villa Chigi, Roma","1300.0","3","70.0","nan","5"
"1690","Quadrilocale via del Governo Vecchio 48, Piazza Navona, Roma","2500.0","4","129.0","2","5"
"1691","Attico piazza di Santa Maria Liberatrice 47, Testaccio, Roma","1200.0","3","75.0","nan","5"
"1692","Trilocale via di Macchia Palocco, Casal Palocco, Roma","1800.0","3","181.0","nan","5"
"1693","Bilocale via Adda 13, Salario - Porta Pia, Roma","800.0","2","40.0","nan","5"
"1694","Trilocale via Appia Nuova 677, Colli Albani, Roma","1400.0","3","100.0","2","5"
