"Index","Title description","Price","N_rooms","Surface","N_toilettes","Floor"
"1133","Bilocale via Achille Loria 31, Fleming, Roma","890.0","2","60.0","nan","1"
"1134","Trilocale via Amantea, Appio Claudio - Statuario, Roma","950.0","3","90.0","nan","1"
"1135","Appartamento via Alfonso Rendano, Africano - Villa Chigi, Roma","1899.0","5+","160.0","2","1"
"1136","Quadrilocale via Romeo Rodriguez Pereira 15, Balduina, Roma","1500.0","4","110.0","nan","1"
"1137","Attico corso Duca di Genova 293, Ostia Ponente, Roma","850.0","3","102.0","nan","1"
"1138","Quadrilocale viale Giuseppe Mazzini, Mazzini - Delle Vittorie, Roma","1450.0","4","85.0","nan","1"
"1139","Trilocale via Cesare De Lollis, San Lorenzo, Roma","1800.0","3","63.0","nan","1"
"1140","Bilocale via Angelo Secchi, Parioli, Roma","1400.0","2","60.0","nan","1"
"1141","Appartamento via Guido Banti, Fleming, Roma","2400.0","5+","135.0","3","1"
"1142","Attico viale dell'Umanesimo 199, Eur, Roma","1750.0","5","132.0","3","1"
"1143","Quadrilocale viale Gianluigi Bonelli 60, Mezzocammino, Roma","1300.0","4","110.0","2","1"
"1144","Appartamento via Cassia 837, Tomba di Nerone, Roma","4000.0","5+","260.0","3+","1"
"1145","Quadrilocale via Teodoro Monticelli, Euclide, Roma","2000.0","4","127.0","2","1"
"1146","Trilocale via Vitaliano Ponti 42, Alessandrino - Torre Spaccata, Roma","780.0","3","101.0","nan","1"
"1147","Trilocale via Sangineto, Centro Giano, Roma","830.0","3","60.0","nan","1"
"1148","Villa unifamiliare via di Villa Ruffo, Flaminio, Roma","8000.0","4","203.0","3","1"
"1149","Trilocale viale Bruno Buozzi 19, Parioli, Roma","1450.0","3","100.0","nan","1"
"1150","Trilocale Appartamento via Gabriele Camozzi, Mazzini - Delle Vittorie, Roma","1650.0","3","115.0","2","1"
"1151","Attico via Gerolamo Belloni, Vigna Clara - Vigna Stelluti, Roma","2800.0","5+","245.0","3","5"
"1152","Quadrilocale via di trasone 6, Africano - Villa Chigi, Roma","2000.0","4","122.0","nan","5"
"1153","Trilocale via Sicilia, Vittorio Veneto, Roma","2100.0","3","92.0","nan","5"
"1154","Appartamento via Passignano sul Trasimeno, Fleming, Roma","2300.0","5","180.0","3","5"
"1155","Quadrilocale via d'Ascanio, Montecitorio, Roma","4200.0","4","130.0","2","5"
"1156","Trilocale via Michele di Lando, Bologna, Roma","1850.0","3","80.0","nan","5"
"1157","Appartamento via Monti Parioli, Parioli, Roma","4300.0","5+","210.0","3+","5"
"1158","Attico via della Scrofa, Montecitorio, Roma","9500.0","4","200.0","3+","5"
"1159","Bilocale via della Farnesina, Camilluccia - Farnesina, Roma","900.0","2","41.0","nan","5"
"1160","Trilocale via Antonino Lo Surdo, Marconi, Roma","1050.0","3","90.0","nan","5"
"1161","Trilocale vicolo del Vicario 130, Gregorio VII - Piccolomini, Roma","1850.0","3","110.0","2","5"
"1162","Quadrilocale piazza di Spagna, Spagna, Roma","3000.0","4","95.0","2","5"
"1163","Trilocale via Urbana, Monti, Roma","1450.0","3","75.0","nan","5"
"1164","Monolocale via Alberto Fortis, Euclide, Roma","850.0","nan","30.0","nan","5"
"1165","Bilocale piazza Trento, Trieste - Coppedè, Roma","1200.0","2","35.0","nan","5"
"1166","Attico via dei Colli della Farnesina, Camilluccia - Farnesina, Roma","4500.0","5+","235.0","3+","5"
"1167","Quadrilocale via Roccaporena, Fleming, Roma","1450.0","4","103.0","2","5"
"1168","Attico piazzale Flaminio 10, Flaminio, Roma","5500.0","3","147.0","2","5"
"1169","Bilocale via Poggio Moiano, Africano - Villa Chigi, Roma","850.0","2","45.0","nan","5"
"1170","Trilocale via D. Jachino 47, Mostacciano, Roma","1050.0","3","110.0","2","5"
"1171","Trilocale via Tusa 29a, Rocca Cencia, Roma","750.0","3","110.0","nan","5"
"1172","Bilocale via Giuseppe Acerbi, Ostiense, Roma","1500.0","2","75.0","nan","5"
"1173","Bilocale via Oderisi da Gubbio, Marconi, Roma","1250.0","2","70.0","nan","5"
"1174","Bilocale via Vincenzo Tiberio, Fleming, Roma","1100.0","2","53.0","nan","5"
"1175","Quadrilocale via Cicerone, Prati, Roma","4500.0","4","144.0","3","5"
"1176","Villa a schiera viale Prassilla, Casal Palocco, Roma","7000.0","5+","400.0","3+","2"
"1177","Quadrilocale via bruno de finetti 153, Castel di Leva, Roma","900.0","4","90.0","2","2"
"1178","Trilocale via Giuseppe Garibaldi 26, Trastevere, Roma","1500.0","3","72.0","2","2"
"1179","Monolocale via Massa di San Giuliano 295, Castelverde, Roma","400.0","nan","18.0","nan","2"
"1180","Quadrilocale via giovanni guareschi 103, Fonte Ostiense, Roma","320.0","4","120.0","2","2"
"1181","Appartamento via di Ripetta, Piazza del Popolo, Roma","3500.0","5","80.0","2","2"
"1182","Trilocale viale gottardo 93, Città Giardino, Roma","1350.0","3","100.0","nan","2"
"1183","Attico via Francesco Saverio Nitti 32, Fleming, Roma","1100.0","3","75.0","nan","2"
"1184","Appartamento via Rivarone, Aurelio - Val Cannuta, Roma","1850.0","nan","230.0","nan","2"
"1185","Trilocale piazza Anco Marzio 25, Ostia Levante, Roma","1000.0","3","110.0","2","2"
"1186","Attico via dell'Elettronica, Eur, Roma","1700.0","2","60.0","nan","2"
"1187","Bilocale via Giampaolo della Chiesa 4, Monteverde Vecchio, Roma","1400.0","2","53.0","nan","2"
"1188","Appartamento piazza Euclide, Euclide, Roma","2100.0","5+","120.0","2","2"
"1189","Bilocale via Laterina 88, Fidene, Roma","650.0","2","73.0","nan","2"
"1190","Trilocale piazza Alessandria, Salario - Porta Pia, Roma","1600.0","3","80.0","2","2"
"1191","Bilocale via della Balduina, Balduina, Roma","880.0","2","65.0","nan","2"
"1192","Appartamento via Arenula 51, Ghetto - Portico d'Ottavia, Roma","4000.0","5+","150.0","nan","2"
"1193","Trilocale via Laurina, Piazza del Popolo, Roma","2500.0","3","70.0","nan","2"
"1194","Villa unifamiliare via di Villa Ruffo, Flaminio, Roma","1000.0","5+","150.0","3","2"
"1195","Appartamento via di Ripetta, Piazza del Popolo, Roma","1000.0","5","261.0","2","2"
"1196","Appartamento viale Regina Margherita 251, Policlinico, Roma","7500.0","5+","375.0","3+","2"
"1197","Trilocale via Annibale Maria di Francia, Fidene, Roma","800.0","3","80.0","nan","2"
"1198","Attico via Francesco Menzio, Acilia, Roma","900.0","3","70.0","2","2"
"1199","Bilocale via Roberto Alessandri, Colli Portuensi - Casaletto, Roma","1300.0","2","70.0","nan","2"
"1200","Attico via Domenico De Dominicis 36, Casal Bertone, Roma","1400.0","2","50.0","nan","2"
"1201","Quadrilocale via Bevagna, Fleming, Roma","1350.0","4","80.0","nan","1"
"1202","Bilocale via Arturo Danusso, Ponte di Nona, Roma","650.0","2","66.0","nan","1"
"1203","Bilocale via Cattaro, Trieste - Coppedè, Roma","1800.0","2","65.0","2","1"
"1204","Bilocale via Giuseppe Martucci 28, Africano - Villa Chigi, Roma","750.0","2","42.0","nan","1"
"1205","Bilocale via Margutta, Piazza del Popolo, Roma","5000.0","2","100.0","2","1"
"1206","Monolocale via Alberto Fortis 11, Euclide, Roma","850.0","nan","30.0","nan","1"
"1207","Bilocale via Campobasso 17, Pigneto, Roma","850.0","2","62.0","nan","1"
"1208","Monolocale via delle Acacie 120, Centocelle, Roma","630.0","nan","47.0","nan","1"
"1209","Quadrilocale viale Ronchi 20, Villa Gordiani, Roma","1100.0","4","100.0","nan","1"
"1210","Appartamento via Vito Artale, Cipro, Roma","1900.0","5","142.0","2","1"
"1211","Attico via Domenico De Dominicis 40, Casal Bertone, Roma","1400.0","2","60.0","nan","1"
"1212","Bilocale via Vicenza, Castro Pretorio, Roma","1600.0","2","60.0","nan","1"
"1213","Appartamento via Passignano sul Trasimeno, Fleming, Roma","2300.0","5","176.0","3","1"
"1214","Bilocale via Mario Menichini, La Giustiniana, Roma","850.0","2","58.0","nan","1"
"1215","Quadrilocale via Giannetto Valli 95, Portuense, Roma","1200.0","4","113.0","2","1"
"1216","Trilocale via dell'Arco di San Calisto, Trastevere, Roma","1900.0","3","80.0","nan","1"
"1217","Trilocale via Monti della Valchetta, Labaro, Roma","790.0","3","76.0","nan","1"
"1218","Bilocale via Bernardino Spada, Torrevecchia, Roma","800.0","2","65.0","nan","1"
"1219","Appartamento via della Balduina 250, Balduina, Roma","2300.0","5+","150.0","3","1"
"1220","Trilocale via Amerigo Vespucci, Testaccio, Roma","1550.0","3","100.0","nan","1"
"1221","Trilocale via Foglia 7, Africano - Villa Chigi, Roma","1200.0","3","85.0","nan","1"
"1222","Trilocale via Angelo Olivieri 57, Ostia Levante, Roma","800.0","3","102.0","nan","1"
"1223","Trilocale via degli Avignonesi, Barberini, Roma","1500.0","3","70.0","nan","1"
"1224","Trilocale via Fontanasalsa, Tor Vergata, Roma","700.0","3","70.0","nan","1"
"1225","Quadrilocale piazza dei Martiri di Belfiore, Mazzini - Delle Vittorie, Roma","1850.0","4","125.0","nan","1"
"1226","Trilocale via Trionfale 7077, Gemelli - Pineta Sacchetti, Roma","1300.0","3","85.0","2","0"
"1227","Monolocale via delle Ciliegie, Alessandrino - Torre Spaccata, Roma","600.0","nan","45.0","nan","0"
"1228","Trilocale piazza Camillo Finocchiaro Aprile 3, Appio Latino, Roma","850.0","3","65.0","nan","0"
"1229","Bilocale via del Boschetto, Monti, Roma","1500.0","2","50.0","nan","0"
"1230","Trilocale via Giuseppe Palumbo, Mazzini - Delle Vittorie, Roma","1650.0","3","75.0","nan","0"
"1231","Trilocale via Ormisda 10, Gregorio VII - Piccolomini, Roma","1000.0","3","83.0","2","0"
"1232","Villa unifamiliare, da ristrutturare, 250 m², Settebagni, Roma","nan","5+","250.0","3+","0"
"1233","Bilocale via cassia 1279, La Giustiniana, Roma","690.0","2","55.0","nan","0"
"1234","Bilocale via Saverio Mercadante 8, Parioli, Roma","2100.0","2","68.0","nan","0"
"1235","Bilocale via Acaia, San Giovanni, Roma","850.0","2","60.0","nan","0"
"1236","Bilocale via Pietro Venturi 61, Portuense, Roma","800.0","2","63.0","nan","0"
"1237","Loft piazza di San Cosimato, Trastevere, Roma","2750.0","3","100.0","2","0"
"1238","Trilocale via Igino Giordani, Casal Bruciato, Roma","950.0","3","80.0","nan","0"
"1239","Quadrilocale via CATULLO, Prati, Roma","2200.0","4","135.0","2","0"
"1240","Appartamento via Cassia 1328, La Giustiniana, Roma","1400.0","5","216.0","2","0"
"1241","Bilocale via Roberto Raviola, Mezzocammino, Roma","950.0","2","70.0","nan","0"
"1242","Villa bifamiliare via di Villa Ruffo, Flaminio, Roma","3000.0","5+","300.0","3+","0"
"1243","Quadrilocale via Eleonora Duse, Parioli, Roma","2200.0","4","119.0","2","0"
"1244","Trilocale via della Chiesa Nuova 14, Piazza Navona, Roma","1800.0","3","90.0","nan","0"
"1245","Trilocale ottimo stato, primo piano, Trieste - Coppedè, Roma","1900.0","3","115.0","2","0"
"1246","Trilocale via Città della Pieve 54, Fleming, Roma","950.0","3","72.0","nan","0"
"1247","Appartamento in villa via Marocco, Eur, Roma","nan","5+","831.0","3+","0"
"1248","Trilocale via Roberto Ghiglianovic, Cecchignola - Giuliano Dalmata, Roma","1100.0","3","100.0","2","0"
"1249","Attico piazza del Popolo 3, Piazza del Popolo, Roma","5000.0","3","140.0","2","0"
"1250","Bilocale via Saverio Mercadante 8, Parioli, Roma","2000.0","2","60.0","nan","0"
"1251","Trilocale via Radicofani, Fidene, Roma","750.0","3","71.0","nan","1"
"1252","Trilocale via Cassia 370, Cassia - San Godenzo, Roma","1800.0","3","115.0","2","1"
"1253","Bilocale via Saverio Mercadante 8, Parioli, Roma","2000.0","2","60.0","nan","1"
"1254","Monolocale via Giuseppe Perego 25, Mostacciano, Roma","730.0","nan","54.0","nan","1"
"1255","Trilocale via Veronica Gambara, Talenti - Monte Sacro, Roma","1250.0","3","119.0","nan","1"
"1256","Bilocale via del Babuino 144, Piazza del Popolo, Roma","1800.0","2","50.0","nan","1"
"1257","Trilocale via Adelaide Ristori, Parioli, Roma","2200.0","3","110.0","2","1"
"1258","Trilocale via Paolo Bentivoglio 31, Gregorio VII - Piccolomini, Roma","1150.0","3","75.0","nan","1"
"1259","Bilocale via Amsterdam 27, Torrino, Roma","1100.0","2","60.0","nan","1"
"1260","Bilocale via del Fosso di Sant'Andrea 92, Morena, Roma","800.0","2","60.0","nan","1"
"1261","Bilocale piazza Attilio Omodei Zorini 55, Collina delle Muse, Roma","950.0","2","60.0","nan","1"
"1262","Bilocale via Collegiove, Tomba di Nerone, Roma","650.0","2","59.0","nan","1"
"1263","Villa a schiera via delle Costellazioni, Torrino, Roma","2500.0","5","200.0","3","1"
"1264","Trilocale via Michele Migliarini, Anagnina, Roma","850.0","3","80.0","nan","1"
"1265","Appartamento piazzale Flaminio 1, Flaminio, Roma","6000.0","5+","190.0","3+","1"
"1266","Bilocale via Antonio Cesari 43, Monteverde Vecchio, Roma","1200.0","2","40.0","nan","1"
"1267","Bilocale via Francesca Bertini, Malafede, Roma","650.0","2","35.0","nan","1"
"1268","Trilocale via Di Donna Olimpia 25, Monteverde Nuovo, Roma","1300.0","3","80.0","2","1"
"1269","Trilocale via Riccardo Zampieri, Casal Bruciato, Roma","1200.0","3","105.0","2","1"
"1270","Appartamento piazza Digione, Parioli, Roma","4200.0","5+","230.0","3+","1"
"1271","Monolocale via di Vermicino 60, Borghesiana, Roma","600.0","nan","50.0","nan","1"
"1272","Appartamento via Arenula, Ghetto - Portico d'Ottavia, Roma","6500.0","5","230.0","2","1"
"1273","Bilocale via Francesco Menzio 30, Acilia, Roma","750.0","2","53.0","nan","1"
"1274","Quadrilocale via Nanchino 38, Torrino, Roma","1500.0","4","120.0","2","1"
"1275","Bilocale via Nomentana 904, Ponte Mammolo, Roma","800.0","2","90.0","nan","1"
"1276","Bilocale via Leonardo Mellano, Acilia, Roma","700.0","2","55.0","nan","3"
"1277","Trilocale via PAOLO ALBERA, Furio Camillo, Roma","1200.0","3","108.0","2","3"
"1278","Bilocale via Cardinale Caprara 58, Boccea, Roma","850.0","2","65.0","nan","3"
"1279","Appartamento buono stato, secondo piano, Colli Portuensi - Casaletto, Roma","2500.0","5","180.0","3","3"
"1280","Trilocale via Corrado Mantoni, Porta di Roma, Roma","1000.0","3","100.0","2","3"
"1281","Attico via delle Canarie, Ostia Ponente, Roma","2000.0","3","110.0","nan","3"
"1282","Quadrilocale piazza Sagona 3, Ostia Levante, Roma","1200.0","4","110.0","2","3"
"1283","Mansarda via Ubaldo Montelatici, Castel di Leva, Roma","750.0","3","70.0","nan","3"
"1284","Monolocale via dei Monti Parioli, Euclide, Roma","850.0","nan","30.0","nan","3"
"1285","Trilocale via Ferdinando Acton, Ostia Levante, Roma","850.0","3","96.0","nan","3"
"1286","Bilocale piazza Ugo da Como, Nuovo Salario, Roma","1280.0","2","90.0","2","3"
"1287","Villa bifamiliare via Francesco Giacomo Tricomi 30, Casal Lumbroso, Roma","2300.0","4","93.0","3+","3"
"1288","Attico largo Messico, Pinciano - Villa Ada, Roma","2300.0","3","115.0","2","3"
"1289","Trilocale via Nomentana, Talenti - Monte Sacro, Roma","950.0","3","85.0","nan","3"
"1290","Bilocale via Nomentana, Talenti - Monte Sacro, Roma","1050.0","2","80.0","nan","3"
"1291","Appartamento via Galloro, Quarto Miglio, Roma","1700.0","5+","210.0","3","3"
"1292","Appartamento piazzale Flaminio, Flaminio, Roma","5000.0","5","200.0","2","3"
"1293","Quadrilocale via Ogaden, Africano - Villa Chigi, Roma","1750.0","4","110.0","2","3"
"1294","Bilocale via Lima 53, Pinciano - Villa Ada, Roma","1700.0","2","66.0","nan","3"
"1295","Villa unifamiliare via Leucippo, Casal Palocco, Roma","2500.0","5+","200.0","3+","3"
"1296","Trilocale via Renzo da Ceri 32, Pigneto, Roma","350.0","3","91.0","2","3"
"1297","Trilocale Circonvallazione Clodia 15, Piazzale degli Eroi, Roma","1350.0","3","75.0","nan","3"
"1298","Bilocale via Angelo Messedaglia, Fleming, Roma","1100.0","2","55.0","nan","3"
"1299","Bilocale via Ugo Della Seta, Nuovo Salario, Roma","890.0","2","70.0","nan","3"
"1300","Trilocale via Pia Nalli 161, Castel di Leva, Roma","900.0","3","82.0","2","3"
"1301","Quadrilocale buono stato, quarto piano, Colli Portuensi - Casaletto, Roma","1100.0","4","113.0","nan","R"
"1302","Bilocale via Pietro Romani 47, Infernetto, Roma","700.0","2","45.0","nan","R"
"1303","Quadrilocale via La Spezia, San Giovanni, Roma","1500.0","4","100.0","nan","R"
"1304","Trilocale via Giulio Venticinque, Cipro, Roma","1380.0","3","115.0","2","R"
"1305","Attico via Alessandro Vivenza 21, Monte Migliore, Roma","550.0","2","57.0","nan","R"
"1306","Bilocale via galli della mantica, Ostia Levante, Roma","700.0","2","60.0","nan","R"
"1307","Bilocale via Vinicio Cortese 147, Mostacciano, Roma","550.0","2","50.0","nan","R"
"1308","Appartamento via Pieve di Cadore, Camilluccia - Farnesina, Roma","2300.0","5","140.0","3","R"
"1309","Trilocale via Tuscolana 666, Cinecittà, Roma","900.0","3","55.0","nan","R"
"1310","Palazzo - Edificio piazza dell'Aracoeli, Colosseo - Fori Imperiali, Roma","2500.0","2","100.0","nan","R"
"1311","Quadrilocale via Francesco Pallavicini 10, Portuense, Roma","1000.0","4","83.0","nan","R"
"1312","Appartamento via Napoleone Colajanni 4, Vigna Clara - Vigna Stelluti, Roma","3500.0","5+","250.0","3+","R"
"1313","Bilocale via Vestricio Spurinna 147, Quadraro, Roma","800.0","2","70.0","nan","R"
"1314","Monolocale via Misurina, Cortina d'Ampezzo, Roma","900.0","nan","51.0","nan","R"
"1315","Trilocale via PALESTRO, Castro Pretorio, Roma","950.0","3","65.0","nan","R"
"1316","Trilocale via Alessandro Vessella 6, Africano - Villa Chigi, Roma","1000.0","3","57.0","nan","R"
"1317","Bilocale via Virgilio Talli 170, Serpentara, Roma","780.0","2","70.0","nan","R"
"1318","Bilocale via Angelo Messedaglia 6, Fleming, Roma","850.0","2","50.0","nan","R"
"1319","Trilocale via Laurentina 1351, Trigoria, Roma","650.0","3","83.0","nan","R"
"1320","Trilocale via Bressanone, Trieste - Coppedè, Roma","1150.0","3","81.0","nan","R"
"1321","Quadrilocale via Renato Fucini, Talenti - Monte Sacro, Roma","1300.0","4","120.0","2","R"
"1322","Attico piazza Rondanini, Pantheon, Roma","5300.0","4","240.0","3","R"
"1323","Appartamento via Ennio Quirino Visconti, Prati, Roma","4200.0","5","210.0","3","R"
"1324","Bilocale via Ildebrando della Giovanna, Massimina, Roma","550.0","2","45.0","nan","R"
"1325","Appartamento via del corso, Montecitorio, Roma","nan","5+","600.0","3+","R"
"1326","Trilocale via Angelo Messedaglia, Fleming, Roma","800.0","3","65.0","nan","3"
"1327","Bilocale via Nicolò Forteguerri 15, Pigneto, Roma","800.0","2","75.0","nan","3"
"1328","Appartamento via salaria, Pinciano - Villa Ada, Roma","2400.0","5","233.0","3","3"
"1329","Bilocale vicolo del Farinone 33, Borgo, Roma","2200.0","2","65.0","nan","3"
"1330","Monolocale ottimo stato, piano terra, Spagna, Roma","1750.0","nan","40.0","nan","3"
"1331","Trilocale via di Grottarossa 1262, Grottarossa - Saxa Rubra, Roma","1600.0","3","199.0","2","3"
"1332","Quadrilocale via della Pisana, Pisana - Bravetta, Roma","1900.0","4","130.0","2","3"
"1333","Open space via San Gimignano, Fidene, Roma","570.0","nan","30.0","nan","3"
"1334","Appartamento buono stato, secondo piano, Cassia - San Godenzo, Roma","1500.0","5","137.0","2","3"
"1335","Quadrilocale via Romolo Gigliozzi, Tor de' Cenci, Roma","1000.0","4","140.0","2","3"
"1336","Quadrilocale piazza dei Consoli, Cinecittà, Roma","1200.0","4","100.0","nan","3"
"1337","Attico via Nicola Martelli, Euclide, Roma","1100.0","5+","300.0","3+","3"
"1338","Trilocale corso Vittorio Emanuele II 252, Campo de' Fiori, Roma","2800.0","3","100.0","nan","3"
"1339","Villa a schiera via della Cecchignola, Cecchignola - Giuliano Dalmata, Roma","1150.0","3","75.0","nan","3"
"1340","Trilocale via Ildebrando Vivanti, Mostacciano, Roma","950.0","3","95.0","nan","3"
"1341","Quadrilocale via Santini, Trastevere, Roma","1500.0","4","120.0","nan","3"
"1342","Attico viale dei Parioli, Parioli, Roma","4200.0","5+","225.0","3","3"
"1343","Bilocale via GIACOMO FOLCHI 16, Monteverde Nuovo, Roma","900.0","2","60.0","nan","3"
"1344","Bilocale via Pian di Sco 68, Nuovo Salario, Roma","830.0","2","68.0","nan","3"
"1345","Quadrilocale via Antonio Gramsci 16, Parioli, Roma","3300.0","4","140.0","2","3"
"1346","Quadrilocale via Aventina, San Saba - Caracalla, Roma","2300.0","4","120.0","2","3"
"1347","Quadrilocale via Tazio Nuvolari, Roma 70, Roma","1300.0","4","143.0","2","3"
"1348","Bilocale via Alessandro Solivetti, Torrevecchia, Roma","750.0","2","45.0","nan","3"
"1349","Appartamento via Ildebrando Vivanti 161, Mostacciano, Roma","2500.0","5+","260.0","3+","3"
"1350","Trilocale via Stefano delle Chiaje 42, Grottarossa - Saxa Rubra, Roma","770.0","3","75.0","nan","3"
"1351","Trilocale via Montasio, Città Giardino, Roma","1150.0","3","95.0","2","3"
"1352","Quadrilocale viale Amelia, Furio Camillo, Roma","1300.0","4","89.0","nan","3"
"1353","Trilocale via Sarteano 32, Nuovo Salario, Roma","1100.0","3","117.0","2","3"
"1354","Bilocale viale dei Promontori, Ostia Levante, Roma","700.0","2","81.0","nan","3"
"1355","Appartamento via del Babuino, Piazza del Popolo, Roma","3000.0","5","130.0","3","3"
"1356","Bilocale via dei Soldati, Piazza Navona, Roma","1800.0","2","65.0","nan","3"
"1357","Trilocale via Sangineto, Centro Giano, Roma","800.0","3","50.0","nan","3"
"1358","Bilocale viale dei Quattro Venti, Monteverde Vecchio, Roma","850.0","2","50.0","nan","3"
"1359","Bilocale piazza Camillo Finocchiaro Aprile, Appio Latino, Roma","900.0","2","70.0","nan","3"
"1360","Bilocale via Grazia Deledda, Talenti - Monte Sacro, Roma","850.0","2","57.0","nan","3"
"1361","Trilocale via del corso, Montecitorio, Roma","nan","3","332.0","2","3"
"1362","Appartamento via Pieve di Cadore, Camilluccia - Farnesina, Roma","2300.0","5","160.0","3","3"
"1363","Bilocale via Dario Niccodemi, Talenti - Monte Sacro, Roma","900.0","2","55.0","nan","3"
"1364","Bilocale via Tullio Martello, Fleming, Roma","850.0","2","65.0","nan","3"
"1365","Attico piazza di Spagna, Spagna, Roma","5000.0","4","166.0","3","3"
"1366","Bilocale piazza del Paradiso, Campo de' Fiori, Roma","1400.0","2","60.0","nan","3"
"1367","Villa unifamiliare via di Grottarossa, Grottarossa - Saxa Rubra, Roma","4500.0","5+","237.0","3","3"
"1368","Attico piazza della Rotonda, Pantheon, Roma","5300.0","4","239.0","3","3"
"1369","Trilocale ottimo stato, piano terra, Borghesiana, Roma","820.0","3","70.0","nan","3"
"1370","Bilocale via Vincenzo Tiberio, Fleming, Roma","1100.0","2","80.0","nan","3"
"1371","Trilocale via San Giovanni in Argentella, Casal Monastero, Roma","800.0","3","74.0","2","3"
"1372","Appartamento via Emilio Almansi 41, Villa Bonelli, Roma","2200.0","5+","160.0","3+","3"
"1373","Trilocale via Alessio Baldovinetti, Tintoretto, Roma","1250.0","3","125.0","2","3"
"1374","Trilocale viale Alessandro Manzoni, Esquilino, Roma","1700.0","3","60.0","2","3"
"1375","Villa bifamiliare via di Selva Nera, Casalotti, Roma","2900.0","5+","324.0","3","3"
"1376","Bilocale via Marco Decumio, Quadraro, Roma","900.0","2","50.0","nan","2"
"1377","Quadrilocale via Andrea Millevoi 83, Cecchignola - Giuliano Dalmata, Roma","nan","4","85.0","2","2"
"1378","Monolocale via Vallombrosa 55, Cortina d'Ampezzo, Roma","1100.0","nan","37.0","nan","2"
"1379","Trilocale via dei Frentani 10, San Lorenzo, Roma","1400.0","3","120.0","2","2"
"1380","Trilocale via Buccari 11, Piazzale degli Eroi, Roma","2100.0","3","130.0","2","2"
"1381","Appartamento via del Corallo 4, Piazza Navona, Roma","3500.0","5+","170.0","2","2"
"1382","Trilocale via Conte Rosso, San Giovanni, Roma","1200.0","3","80.0","nan","2"
"1383","Bilocale via Tuscolana 851, Cinecittà, Roma","850.0","2","72.0","nan","2"
"1384","Quadrilocale via Labicana, Colosseo - Fori Imperiali, Roma","3500.0","4","180.0","3","2"
"1385","Trilocale via 24 Maggio 46, Monti, Roma","2100.0","3","131.0","2","2"
"1386","Quadrilocale via Cesare Fracassini 18, Flaminio, Roma","2300.0","4","95.0","nan","2"
"1387","Trilocale viale dei Caduti nella Guerra di Liberazione, Spinaceto, Roma","850.0","3","120.0","2","2"
"1388","Villa unifamiliare via dei Due Ponti, Tomba di Nerone, Roma","1200.0","5+","700.0","3+","2"
"1389","Trilocale via Guido Banti, Fleming, Roma","1300.0","3","75.0","nan","2"
"1390","Monolocale via Francesco Maria Greco, Torrevecchia, Roma","640.0","nan","43.0","nan","2"
"1391","Bilocale via San Gimignano, Fidene, Roma","700.0","2","55.0","nan","2"
"1392","Bilocale via dello Sci 3, Vigna Clara - Vigna Stelluti, Roma","1000.0","2","37.0","nan","2"
"1393","Appartamento ottimo stato, primo piano, Spagna, Roma","4300.0","5+","141.0","2","2"
"1394","Attico via dei Gozzadini, Gregorio VII - Piccolomini, Roma","1200.0","nan","40.0","nan","2"
"1395","Trilocale via Nino Berrini, La Storta, Roma","850.0","3","90.0","2","2"
"1396","Trilocale via Buccari, Piazzale degli Eroi, Roma","1900.0","3","110.0","nan","2"
"1397","Appartamento via Roncegno, Camilluccia - Farnesina, Roma","2100.0","5","186.0","3","2"
"1398","Trilocale via Giulio Curioni, Pietralata, Roma","1300.0","3","120.0","2","2"
"1399","Appartamento piazza del Popolo, Piazza del Popolo, Roma","1350.0","5+","430.0","3+","2"
"1400","Quadrilocale via Riccardo Grazioli Lante, Mazzini - Delle Vittorie, Roma","2400.0","4","132.0","2","2"
"1401","Bilocale via Bruno Serotini, La Giustiniana, Roma","680.0","2","61.0","nan","4"
"1402","Appartamento via Roncegno, Camilluccia - Farnesina, Roma","2000.0","5","188.0","3","4"
"1403","Bilocale via Amerigo Vespucci, Testaccio, Roma","1350.0","2","75.0","nan","4"
"1404","Appartamento via Giambattista Pagano 22, Aurelio - Val Cannuta, Roma","1200.0","5+","90.0","2","4"
"1405","Appartamento via Asmara, Africano - Villa Chigi, Roma","2300.0","5","177.0","3","4"
"1406","Trilocale via Calatafimi, Repubblica, Roma","1600.0","3","100.0","2","4"
"1407","Appartamento piazza Oderico da Pordenone, Garbatella, Roma","1900.0","5","156.0","2","4"
"1408","Palazzo - Edificio viale Castrense 9, San Giovanni, Roma","5750.0","nan","2.878","nan","4"
"1409","Monolocale via Edoardo Jenner, Colli Portuensi - Casaletto, Roma","730.0","nan","51.0","nan","4"
"1410","Trilocale via Cattaro 1, Trieste - Coppedè, Roma","1350.0","3","85.0","2","4"
"1411","Quadrilocale viale dell'Astronomia 13, Eur, Roma","1700.0","4","140.0","2","4"
"1412","Appartamento via riccobono, Casal Lumbroso, Roma","1150.0","5","190.0","2","4"
"1413","Trilocale via Vincenzo Tieri, La Storta, Roma","850.0","3","81.0","2","4"
