"Index","Title description","Price","N_rooms","Surface","N_toilettes","Floor"
"1","Quadrilocale Roberto da bari , 56, Murat, Bari","1400.0","4","138.0","2","2"
"2","Appartamento via Papa Innocenzo XII 42, Poggiofranco, Bari","1500.0","5","180.0","2","2"
"3","Quadrilocale corso Cavour 72, Murat, Bari","3000.0","4","115.0","nan","2"
"4","Bilocale via Monfalcone 63, Carrassi, Bari","650.0","2","49.0","nan","2"
"5","Villa plurifamiliare via Lorenzo d'Agostino 3, Mungivacca, Bari","1200.0","3","145.0","2","2"
"6","Quadrilocale via Michele Troisi, Japigia, Bari","800.0","4","120.0","2","2"
"7","Attico via Alessandro Maria Calefati, Murat, Bari","1800.0","5","130.0","2","2"
"8","Attico via De Rossi 114, Murat, Bari","650.0","2","70.0","nan","2"
"9","Trilocale Lungomare Ugo Lorusso 49/C, Palese, Bari","1000.0","3","60.0","nan","2"
"10","Quadrilocale via Salvatore Matarrese, Poggiofranco, Bari","1500.0","4","139.0","2","2"
"11","Bilocale viale concilio vaticano 160, Poggiofranco, Bari","800.0","2","71.0","nan","2"
"12","Attico via Argiro 7, Murat, Bari","1000.0","2","51.0","nan","2"
"13","Appartamento Tanzi , 2/B, Umbertina - Madonnella, Bari","950.0","5","113.0","nan","2"
"14","Quadrilocale corso Camillo Benso di Cavour 72, Murat, Bari","1500.0","4","140.0","2","2"
"15","Attico via Pappacena, Poggiofranco, Bari","1400.0","4","150.0","2","2"
"16","Attico Lungomare Giovan Battista e Pietro Starita 60, Marconi - San Cataldo, Bari","1500.0","4","136.0","2","2"
"17","Quadrilocale ottimo stato, quarto piano, San Pasquale, Bari","1200.0","4","173.0","2","2"
"18","Trilocale piazza Armando Diaz 5, Umbertina - Madonnella, Bari","950.0","3","105.0","nan","2"
"19","Bilocale via Tanzi 35, Umbertina - Madonnella, Bari","620.0","2","63.0","nan","2"
"20","Trilocale via Titolo, Santo Spirito, Bari","750.0","3","100.0","nan","2"
"21","Trilocale via Giuseppe Petraglione 11, Poggiofranco, Bari","720.0","3","110.0","nan","2"
"22","Quadrilocale via Scipione l'Africano 193, Picone, Bari","1400.0","4","120.0","2","2"
"23","Bilocale via Giovanni Pascoli 4, Carbonara di Bari, Bari","650.0","2","80.0","nan","2"
"24","Trilocale via Fratelli De Filippo 16, Carbonara di Bari, Bari","900.0","3","103.0","2","2"
"25","Bilocale via Giovanni Laterza 61, Carrassi, Bari","820.0","2","72.0","nan","2"
"26","Quadrilocale via Sparano da Bari, Murat, Bari","1600.0","4","135.0","2","6"
"27","Attico via Alessandro Maria Calefati 72, Murat, Bari","1350.0","3","154.0","2","6"
"28","Trilocale via Giovanni Amendola 168/5, Japigia, Bari","1000.0","3","90.0","nan","6"
"29","Bilocale cairoli , 54, Murat, Bari","850.0","2","60.0","nan","6"
"30","Quadrilocale via Abbrescia , 64, Umbertina - Madonnella, Bari","1500.0","4","115.0","2","6"
"31","Bilocale via delle Murge 108, Santa Caterina, Bari","1500.0","2","78.0","nan","6"
"32","Trilocale via Giuseppe Petraglione, Poggiofranco, Bari","900.0","3","106.0","2","6"
"33","Trilocale via Giuseppe Petraglione, Poggiofranco, Bari","900.0","3","106.0","2","6"
"34","Quadrilocale via Giulio Petroni, Poggiofranco, Bari","800.0","4","133.0","2","6"
"35","Appartamento via Monsignor Domenico Morea 9, Poggiofranco, Bari","1000.0","5","189.0","2","6"
"36","Appartamento Lungomare Giovan Battista e Pietro Starita 60, Marconi - San Cataldo, Bari","nan","5","158.0","3","6"
"37","Appartamento V.le Antonio Meucci 15, San Pasquale, Bari","990.0","5+","315.0","3","6"
"38","Trilocale via Giovanni Amendola 126, Japigia, Bari","900.0","3","74.0","nan","6"
"39","Quadrilocale via Carlo Alberto Dalla Chiesa 8, Carbonara di Bari, Bari","1000.0","4","130.0","2","6"
"40","Trilocale via Capitano Pasquale Lofoco 20, Japigia, Bari","700.0","3","93.0","2","6"
"41","Quadrilocale via Adolfo Omodeo 61, San Pasquale, Bari","650.0","4","127.0","nan","6"
"42","Bilocale via Dante Alighieri 282, Murat, Bari","750.0","2","70.0","nan","6"
"43","Appartamento via Nicolò Putignani 118, Murat, Bari","1200.0","5","150.0","2","6"
"44","Trilocale via Benedetto Cairoli 97, Murat, Bari","1000.0","3","100.0","nan","6"
"45","Appartamento via delle Murge, Picone, Bari","1800.0","5+","220.0","2","6"
"46","Villa unifamiliare via GIANCASPRO 8, Santo Spirito, Bari","1500.0","5+","300.0","3","6"
"47","Trilocale via Argiro 33, Murat, Bari","1290.0","3","120.0","2","6"
"48","Trilocale via Giambattista Bonazzi 3, Murat, Bari","1100.0","3","83.0","nan","6"
"49","Monolocale via Gian Giuseppe Carulli 46, Umbertina - Madonnella, Bari","nan","nan","50.0","nan","6"
"50","Appartamento via Principe Amedeo 66, Murat, Bari","1500.0","5","180.0","3+","6"
"51","Bilocale via Giuseppe Sangiorgi snc, Santa Caterina, Bari","900.0","2","80.0","nan","6"
"52","Attico viale Papa Giovanni XXIII 58, Poggiofranco, Bari","630.0","nan","50.0","nan","6"
"53","Monolocale via Giulio Petroni 120, Poggiofranco, Bari","650.0","nan","35.0","nan","6"
"54","Quadrilocale via G. Salvemini, San Pasquale, Bari","1400.0","4","122.0","2","6"
"55","Trilocale viale J.f. Kennedy , 4, Poggiofranco, Bari","900.0","3","97.0","nan","6"
"56","Bilocale Strada Degli Orefici 3, San Nicola - Borgo Antico, Bari","800.0","2","53.0","nan","6"
"57","Trilocale via Napoli 21M, Santo Spirito, Bari","1000.0","3","106.0","nan","6"
"58","Quadrilocale via Giuseppe Posca, Poggiofranco, Bari","1400.0","4","121.0","2","6"
"59","Palazzo - Edificio via Giuseppe Capruzzi 15, San Pasquale, Bari","nan","4","238.0","nan","6"
"60","Trilocale via delle Murge 58, Picone, Bari","700.0","3","80.0","nan","6"
"61","Appartamento via Goffredo Mameli 4, Umbertina - Madonnella, Bari","1600.0","5","150.0","2","6"
"62","Bilocale via Argiro 135, Murat, Bari","1600.0","2","65.0","nan","6"
"63","Monolocale via Principessa Iolanda, San Pasquale, Bari","700.0","nan","25.0","nan","6"
"64","Villa unifamiliare via Napoli 5, Santo Spirito, Bari","4000.0","5+","742.0","3","6"
"65","Bilocale Strada Statale 16 384-386, Fesca, Bari","500.0","2","45.0","nan","6"
"66","Bilocale via Camillo Rosalba, Poggiofranco, Bari","800.0","2","65.0","nan","6"
"67","Monolocale ottimo stato, terzo piano, San Pasquale, Bari","800.0","nan","39.0","nan","6"
"68","Appartamento corso Vittorio Emanuele II, 193, Murat, Bari","5000.0","5+","320.0","2","6"
"69","Bilocale ottimo stato, ammezzato, Murat, Bari","700.0","2","47.0","nan","6"
"70","Bilocale via De Rossi, Murat, Bari","1500.0","2","50.0","nan","6"
"71","Attico viale Papa Giovanni XXIII, Carrassi, Bari","630.0","nan","50.0","nan","6"
"72","Trilocale buono stato, settimo piano, Picone, Bari","850.0","3","109.0","nan","6"
"73","Trilocale de cesare , 16, Bari","1200.0","3","95.0","3","6"
"74","Monolocale via Argiro, Murat, Bari","1200.0","nan","40.0","nan","6"
"75","Terratetto unifamiliare via Bitritto 99, Santa Caterina, Bari","2500.0","5+","420.0","nan","6"
"76","Trilocale via Guglielmo Oberdan, Japigia, Bari","1200.0","3","87.0","2","8"
"77","Bilocale corso Cavour 142, Murat, Bari","1200.0","2","70.0","nan","8"
"78","Quadrilocale Trav. via Nazionale 3 BIS, Palese, Bari","1500.0","4","120.0","2","8"
"79","Palazzo - Edificio piazza della Torre 34, Torre a Mare, Bari","6000.0","5+","557.0","nan","8"
"80","Appartamento buono stato, quinto piano, San Pasquale, Bari","1500.0","5","130.0","2","8"
"81","Monolocale via Scaturchio, San Girolamo, Bari","1500.0","nan","162.0","nan","8"
"82","Monolocale viale Ennio 3, Picone, Bari","800.0","nan","60.0","nan","8"
"83","Villa unifamiliare via dei gerani, Bari","700.0","3","70.0","nan","8"
"84","Appartamento via Nilo 18, Carbonara di Bari, Bari","900.0","5","100.0","2","8"
"85","Monolocale via Pasubio 92, Carrassi, Bari","1500.0","nan","390.0","nan","8"
"86","Trilocale via Gargasole , 16, Carrassi, Bari","800.0","3","98.0","nan","8"
"87","Monolocale via Capruzzi 284, Picone, Bari","1200.0","nan","120.0","nan","8"
"88","Appartamento via De Rossi 190, Murat, Bari","800.0","5","130.0","2","8"
"89","Bilocale via Melo da Bari, Murat, Bari","600.0","2","60.0","nan","8"
"90","Appartamento via Capruzzi, 284, Picone, Bari","nan","nan","120.0","nan","8"
"91","Villa plurifamiliare via Fanelli, Carbonara di Bari, Bari","nan","5+","3.2","nan","8"
"92","Monolocale via Maria Cristina di Savoia 58, San Pasquale, Bari","630.0","nan","30.0","nan","8"
"93","Bilocale via Bitritto 100, Santa Caterina, Bari","600.0","2","1.0","nan","8"
"94","Trilocale via Alessandro Maria Calefati 272, Murat, Bari","900.0","3","110.0","2","8"
"95","Bilocale via Vittorio Veneto 34, Palese, Bari","570.0","2","70.0","nan","8"
"96","Bilocale via Bengasi 7, Picone, Bari","1000.0","2","40.0","nan","8"
"97","Trilocale via Vittorio Veneto 25, Palese, Bari","1000.0","3","140.0","2","8"
"98","Bilocale via Giovanni Amendola 61, San Pasquale, Bari","900.0","2","82.0","nan","8"
"99","Bilocale via Bengasi 25, Picone, Bari","1300.0","2","85.0","nan","8"
"100","Trilocale via Sagarriga Visconti 176, Murat, Bari","1300.0","3","81.0","nan","8"
"101","Villa a schiera via Alfredo Giovine 49, San Giorgio, Bari","650.0","3","95.0","nan","6"
"102","Monolocale via Principe Amedeo 40, Murat, Bari","1050.0","nan","48.0","nan","6"
"103","Bilocale via Antonio e Nicola Sorrentino 6, Carrassi, Bari","1150.0","2","50.0","nan","6"
"104","Bilocale via Antonio e Nicola Sorrentino 6, Carrassi, Bari","1200.0","2","60.0","nan","6"
"105","Trilocale via Suor Maria Lucchesi 3, Santo Spirito, Bari","750.0","3","80.0","nan","6"
"106","Loft traversa Isonzo 263, Picone, Bari","970.0","nan","35.0","nan","6"
"107","Trilocale via Monfalcone 5, Carrassi, Bari","1000.0","3","90.0","nan","6"
"108","Quadrilocale via Gaetano Devitofrancesco 31/C, Carrassi, Bari","1200.0","4","120.0","2","6"
"109","Bilocale via Trento 3, San Pasquale, Bari","575.0","2","70.0","nan","6"
"110","Bilocale via Emanuele Mola 14, Umbertina - Madonnella, Bari","1500.0","2","65.0","nan","6"
"111","Bilocale viale dei Caduti di Tutte le Guerre 1, Japigia, Bari","700.0","2","54.0","nan","6"
"112","Bilocale Stradella Petrera 8, San Pasquale, Bari","900.0","2","40.0","nan","6"
"113","Bilocale via Quintino Sella 72, Murat, Bari","850.0","2","95.0","nan","6"
"114","Trilocale via Stefano Felis 2, Santo Spirito, Bari","1200.0","3","130.0","nan","6"
"115","Bilocale via Lecce 34, Picone, Bari","700.0","2","40.0","nan","6"
"116","Bilocale viale dei Caduti di Tutte le Guerre, Japigia, Bari","800.0","2","66.0","nan","6"
"117","Appartamento via 24 Maggio 36, Umbertina - Madonnella, Bari","3700.0","5","180.0","2","6"
"118","Quadrilocale corso Camillo Benso di Cavour 113, Murat, Bari","1900.0","4","170.0","2","6"
"119","Appartamento via Mauro Amoruso 18, Poggiofranco, Bari","700.0","nan","95.0","nan","6"
"120","Trilocale via Vittorio Veneto, Palese, Bari","900.0","3","140.0","2","6"
"121","Bilocale via Ernesto Che Guevara 18, Poggiofranco, Bari","600.0","2","60.0","nan","6"
"122","Bilocale via Michele Garruba 122, Murat, Bari","420.0","2","45.0","nan","6"
"123","Appartamento via Giulio Petroni 119, Poggiofranco, Bari","600.0","nan","50.0","nan","6"
"124","Palazzo - Edificio via Savona 6, Santo Spirito, Bari","420.0","nan","45.0","nan","6"
"125","Bilocale via Giulio Petroni 100, Poggiofranco, Bari","550.0","2","39.0","nan","6"
"126","Bilocale via Maria Cristina di Savoia 58, San Pasquale, Bari","650.0","2","50.0","nan","0"
