"Index","Title description","Price","N_rooms","Surface","N_toilettes","Floor"
"1","Quadrilocale ottimo stato, terzo piano, Ponte Crencano, Verona","1250.0","4","120.0","2","3"
"2","Terratetto unifamiliare 200 m², buono stato, Cà di David, Verona","1600.0","5+","200.0","3","3"
"3","Quadrilocale ottimo stato, secondo piano, Valdonega, Verona","1000.0","4","110.0","nan","3"
"4","Bilocale via Tezone 1, Cittadella - Porta Nuova, Verona","1100.0","2","55.0","nan","3"
"5","Bilocale via Dietro Filippini 20, Centro Storico, Verona","850.0","2","50.0","nan","3"
"6","Trilocale via Carlo Cattaneo, Centro Storico, Verona","1500.0","3","140.0","2","3"
"7","Appartamento via Gian Battista Giberti, Valverde, Verona","1400.0","5","198.0","2","3"
"8","Appartamento stradone Porta Palio, Valverde, Verona","1400.0","5","177.0","2","3"
"9","Trilocale via Santa Felicita 2, Centro Storico, Verona","2200.0","3","100.0","2","3"
"10","Trilocale via Bezzecca, Borgo Trento, Verona","1000.0","3","87.0","nan","3"
"11","Quadrilocale 96 m², Borgo Venezia, Verona","960.0","4","96.0","nan","3"
"12","Trilocale piazza delle Erbe, Centro Storico, Verona","1500.0","3","95.0","nan","3"
"13","Quadrilocale via Carlo Donati, Valdonega, Verona","2200.0","4","140.0","2","3"
"14","Monolocale vicolo Ognissanti 9, San Zeno, Verona","530.0","nan","40.0","nan","3"
"15","Bilocale via Croce Bianca 31, San Massimo - Croce Bianca, Verona","870.0","2","70.0","nan","3"
"16","Bilocale Lungadige Cangrande, Borgo Trento, Verona","800.0","2","50.0","nan","3"
"17","Trilocale piazza Martiri della Libertà 2, Veronetta, Verona","1000.0","3","75.0","nan","3"
"18","Trilocale vicolo Cere, San Zeno, Verona","1400.0","3","100.0","nan","3"
"19","Monolocale Vicoletto Cieco Colomba 4, Centro Storico, Verona","800.0","nan","50.0","nan","3"
"20","Appartamento Lungadige Cangrande 1, Borgo Trento, Verona","3000.0","5+","230.0","3","3"
"21","Quadrilocale via Abramo Massalongo, Centro Storico, Verona","1950.0","4","130.0","2","3"
"22","Quadrilocale vicolo Circolo 4, Valverde, Verona","900.0","4","90.0","nan","3"
"23","Bilocale vicolo San Bernardino 2, San Zeno, Verona","850.0","2","69.0","nan","3"
"24","Quadrilocale via 24 Maggio 37, Borgo Trento, Verona","1150.0","4","120.0","2","3"
"25","Appartamento via Anfiteatro, 16, Centro Storico, Verona","2500.0","5","120.0","2","3"
"26","Trilocale piazzale Olimpia, Stadio, Verona","800.0","3","127.0","nan","4"
"27","Trilocale via Giuseppe Garibaldi, Centro Storico, Verona","1400.0","3","130.0","2","4"
"28","Bilocale via Trento 22, Ponte Crencano, Verona","700.0","2","50.0","nan","4"
"29","Appartamento via Astico 1, Ponte Crencano, Verona","950.0","5","120.0","2","4"
"30","Bilocale via QUATTRO STAGIONI, Borgo Venezia, Verona","700.0","2","57.0","nan","4"
"31","Trilocale via SORGENTE LORI' 1, Avesa, Verona","900.0","3","60.0","nan","4"
"32","Mansarda via Trieste 60, Borgo Roma, Verona","690.0","3","80.0","nan","4"
"33","Attico vicolo Cieco Bacco 1, Veronetta, Verona","1150.0","3","92.0","nan","4"
"34","Bilocale vicolo Stella 11, Centro Storico, Verona","1100.0","2","65.0","nan","4"
"35","Quadrilocale via Arno 5, Santa Lucia - Golosine, Verona","700.0","4","82.0","nan","4"
"36","Appartamento salita Santo Sepolcro 4, Veronetta, Verona","1200.0","5","122.0","2","4"
"37","Quadrilocale via Trento 5, Ponte Crencano, Verona","1200.0","4","132.0","2","4"
"38","Quadrilocale via Santa Felicita 2, Centro Storico, Verona","3000.0","4","130.0","2","4"
"39","Terratetto unifamiliare via tagliamento 21, Quinzano, Verona","1300.0","5","113.0","2","4"
"40","Trilocale corso Venezia 7, Borgo Venezia, Verona","900.0","3","65.0","nan","4"
"41","Trilocale piazza piazza Martiri della libertà, Veronetta, Verona","900.0","3","90.0","nan","4"
"42","Trilocale via Giuseppe Garibaldi, Centro Storico, Verona","1200.0","3","85.0","nan","4"
"43","Trilocale via San Nazaro 60, Veronetta, Verona","850.0","3","60.0","2","4"
"44","Bilocale via 20 Settembre 26, Veronetta, Verona","550.0","2","50.0","nan","4"
"45","Bilocale via dei Mutilati, Valverde, Verona","750.0","2","55.0","nan","4"
"46","Terratetto unifamiliare via MONTE ORTIGARA, Pindemonte, Verona","1350.0","5","150.0","2","4"
"47","Trilocale Alto San Nazaro, Veronetta, Verona","1400.0","3","80.0","2","4"
"48","Quadrilocale via 24 maggio 20, Borgo Trento, Verona","1300.0","4","125.0","2","4"
"49","Trilocale via Galileo Galilei 105, Porto San Pancrazio, Verona","650.0","3","85.0","nan","4"
"50","Bilocale via Fama, Centro Storico, Verona","850.0","2","60.0","nan","4"
"51","Quadrilocale via Galileo Galilei 53, Porto San Pancrazio, Verona","900.0","4","85.0","nan","1"
"52","Trilocale via Alvise da Mosto, Borgo Nuovo - Navigatori, Verona","1000.0","3","90.0","2","1"
"53","Appartamento via Valerio Catullo, Centro Storico, Verona","3000.0","5","168.0","2","1"
"54","Bilocale via duomo 6, Centro Storico, Verona","1000.0","2","55.0","nan","1"
"55","Trilocale via Paolo Sarpi 27, Porto San Pancrazio, Verona","720.0","3","83.0","nan","1"
"56","Trilocale via Aspromonte 8, Borgo Trento, Verona","1600.0","3","122.0","3","1"
"57","Appartamento via Quarto 30, Valdonega, Verona","950.0","5","128.0","nan","1"
"58","Bilocale via Tito Speri, Centro Storico, Verona","500.0","2","40.0","nan","1"
"59","Quadrilocale via Santa Felicita 2, Centro Storico, Verona","3000.0","4","130.0","2","1"
"60","Quadrilocale via Santa Felicita 2, Centro Storico, Verona","3500.0","4","150.0","3","1"
"61","Quadrilocale buono stato, secondo piano, Veronetta, Verona","1100.0","4","102.0","nan","1"
"62","Trilocale via Santa Chiara 11, Veronetta, Verona","1400.0","3","86.0","nan","1"
"63","Quadrilocale viale Spolverini, Borgo Venezia, Verona","750.0","4","116.0","nan","1"
"64","Trilocale via Santa Maria Rocca Maggiore, Veronetta, Verona","1400.0","3","130.0","2","1"
"65","Quadrilocale via 24 Maggio, Borgo Trento, Verona","900.0","4","95.0","nan","1"
"66","Trilocale ottimo stato, terzo piano, Veronetta, Verona","1400.0","3","85.0","2","1"
"67","Bilocale Corticella Cadrega ,3, Centro Storico, Verona","1050.0","2","40.0","nan","1"
"68","Bilocale via Ugo Zannoni 16, Zona Fiera, Verona","900.0","2","52.0","nan","1"
"69","Bilocale via Macello 6, Centro Storico, Verona","850.0","2","45.0","nan","1"
"70","Monolocale Vicoletto Corticella Vetri 1, Veronetta, Verona","550.0","nan","45.0","nan","1"
"71","Trilocale piazzetta Portichetti 1A, San Zeno, Verona","950.0","3","77.0","nan","1"
"72","Trilocale vicolo Borgo Tascherio 13, Veronetta, Verona","800.0","3","65.0","nan","1"
"73","Trilocale vicolo basso acquar, Borgo Roma, Verona","800.0","3","90.0","nan","1"
"74","Bilocale via Goffredo Mameli 118, Borgo Trento, Verona","750.0","2","55.0","nan","1"
"75","Bilocale via Ponte Pietra, Centro Storico, Verona","825.0","2","70.0","nan","1"
"76","Trilocale via Scrimiari 10, Veronetta, Verona","1200.0","3","105.0","2","1"
"77","Bilocale via San Rocchetto, Centro Storico, Verona","650.0","2","50.0","nan","1"
"78","Trilocale via Carlo Ederle 5, Borgo Trento, Verona","1350.0","3","120.0","2","1"
"79","Bilocale via Montorio, Borgo Venezia, Verona","790.0","2","75.0","nan","1"
"80","Bilocale vicolo Cieco Bacco 1, Veronetta, Verona","750.0","2","62.0","nan","1"
"81","Trilocale vicolo Basso Acquar, Zona Fiera, Verona","900.0","3","90.0","nan","1"
"82","Trilocale via Circonvallazione Alfredo Oriani 6, Valverde, Verona","1350.0","3","120.0","2","1"
"83","Quadrilocale Ponte Delle Navi, Veronetta, Verona","2500.0","4","150.0","2","1"
"84","Terratetto unifamiliare 112 m², ottimo stato, Avesa, Verona","2000.0","4","112.0","3","1"
"85","Appartamento via schiapparelli, Zona Fiera, Verona","1000.0","5","150.0","2","1"
"86","Trilocale corno d'aqulio, 29, Ponte Crencano, Verona","750.0","3","72.0","nan","1"
"87","Quadrilocale piazza dei Caduti 45, Santa Lucia - Golosine, Verona","720.0","4","73.0","nan","1"
"88","Bilocale Stradone San Tomaso, Veronetta, Verona","750.0","2","50.0","nan","1"
"89","Quadrilocale 95 m², Pindemonte, Verona","950.0","4","95.0","nan","1"
"90","Trilocale via Roveggia, Zona Fiera, Verona","800.0","3","90.0","nan","1"
"91","Trilocale via Giuseppe Venturi, Borgo Venezia, Verona","1200.0","3","100.0","nan","1"
"92","Quadrilocale via Fiumicello, Borgo Venezia, Verona","650.0","4","90.0","nan","1"
"93","Appartamento nuovo, primo piano, Quinto, Verona","1500.0","5","190.0","3","1"
"94","Appartamento nuovo, piano terra, Quinto, Verona","1600.0","5","198.0","3","1"
"95","Bilocale via Amatore Sciesa, Valverde, Verona","780.0","2","40.0","nan","1"
"96","Quadrilocale piazzetta Santi Apostoli, Centro Storico, Verona","1500.0","4","115.0","2","1"
"97","Trilocale via Sasse, Castiglione, Verona","1300.0","3","120.0","3","1"
"98","Appartamento nuovo, piano terra, Quinto, Verona","1200.0","5","156.0","2","1"
"99","Bilocale via Tommaso Campanella, Porto San Pancrazio, Verona","600.0","2","50.0","nan","1"
"100","Quadrilocale buono stato, primo piano, Pindemonte, Verona","1100.0","4","113.0","2","1"
"101","Monolocale buono stato, terzo piano, Borgo Roma, Verona","590.0","nan","41.0","nan","2"
"102","Quadrilocale via centro 9, Borgo Roma, Verona","800.0","4","110.0","nan","2"
"103","Trilocale ottimo stato, primo piano, Borgo Venezia, Verona","720.0","3","72.0","nan","2"
"104","Trilocale via Brigata Composta, Santa Lucia - Golosine, Verona","850.0","3","90.0","nan","2"
"105","Bilocale via Fiumicello, Borgo Venezia, Verona","570.0","2","50.0","nan","2"
"106","Quadrilocale vicolo Corte Spagnola 1, Centro Storico, Verona","1300.0","4","120.0","nan","2"
"107","Appartamento nuovo, primo piano, Quinto, Verona","1400.0","5","160.0","2","2"
"108","Appartamento Stradone Scipione Maffei, Centro Storico, Verona","2800.0","5","170.0","3","2"
"109","Villa a schiera via Lazzaretto 3, Porto San Pancrazio, Verona","800.0","2","78.0","nan","2"
"110","Appartamento ottimo stato, Borgo Trento, Verona","1200.0","5","120.0","2","2"
"111","Bilocale vicolo San Domenico 20, Cittadella - Porta Nuova, Verona","1000.0","2","nan","nan","2"
"112","Bilocale via Mercurio 1, Sacra Famiglia - Castel D'Azzano, Verona","630.0","2","65.0","nan","2"
"113","Bilocale ottimo stato, terzo piano, Borgo Roma, Verona","700.0","2","65.0","nan","2"
"114","Monolocale via Paolo Sarpi 18/d, Porto San Pancrazio, Verona","600.0","nan","35.0","nan","2"
"115","Trilocale via Stella, Centro Storico, Verona","1200.0","3","80.0","nan","2"
"116","Quadrilocale via Giovanni Segantini, Stadio, Verona","900.0","4","85.0","nan","2"
"117","Mansarda via San Cosimo, Centro Storico, Verona","1550.0","3","115.0","2","2"
"118","Bilocale ottimo stato, terzo piano, Borgo Roma, Verona","620.0","2","50.0","nan","2"
"119","Quadrilocale via Stella 19, Centro Storico, Verona","900.0","4","75.0","nan","2"
"120","Bilocale ottimo stato, primo piano, Centro Storico, Verona","1200.0","2","65.0","nan","2"
"121","Bilocale vicolo San Domenico 20, Cittadella - Porta Nuova, Verona","1200.0","2","72.0","nan","2"
"122","Quadrilocale buono stato, terzo piano, Borgo Venezia, Verona","600.0","4","106.0","nan","2"
"123","Bilocale vicolo San Domenico 20, Cittadella - Porta Nuova, Verona","1000.0","2","65.0","nan","2"
"124","Bilocale ottimo stato, piano rialzato, Borgo Trento, Verona","800.0","2","45.0","nan","2"
"125","Trilocale corso Porta Nuova, Cittadella - Porta Nuova, Verona","nan","3","170.0","2","2"
"126","Trilocale buono stato, primo piano, San Michele Extra, Verona","1300.0","3","80.0","nan","1"
"127","Trilocale via Rosa, Centro Storico, Verona","2200.0","3","110.0","2","1"
"128","Bilocale Strada Bresciana 37, San Massimo - Croce Bianca, Verona","700.0","2","50.0","nan","1"
"129","Bilocale quarto piano, Borgo Nuovo - Navigatori, Verona","900.0","2","74.0","nan","1"
"130","Bilocale via Angelo Emo, Borgo Nuovo - Navigatori, Verona","550.0","2","55.0","nan","1"
"131","Trilocale via Lodovico Cendrata, Borgo Venezia, Verona","670.0","3","95.0","nan","1"
"132","Bilocale via Giuseppe Marconcini, Porto San Pancrazio, Verona","750.0","2","70.0","nan","1"
"133","Monolocale via Santa Chiara, Veronetta, Verona","700.0","nan","35.0","nan","1"
"134","Bilocale via Giuseppe Verdi, Santa Croce, Verona","580.0","2","66.0","nan","1"
"135","Trilocale via San Marco, Stadio, Verona","800.0","3","50.0","nan","1"
"136","Bilocale via La Fratellanza, San Massimo - Croce Bianca, Verona","650.0","2","60.0","nan","1"
"137","Monolocale corso Venezia, Borgo Venezia, Verona","360.0","nan","11.0","nan","1"
"138","Bilocale via San Nazaro, Veronetta, Verona","700.0","2","55.0","nan","1"
"139","Monolocale via Santa Chiara, Veronetta, Verona","600.0","nan","30.0","nan","1"
"140","Trilocale via Belfiore, Cà di David, Verona","290.0","3","30.0","nan","1"
"141","Bilocale via Aldo Fedeli, San Michele Extra, Verona","480.0","2","40.0","nan","1"
"142","Bilocale via Legnago, Borgo Roma, Verona","600.0","2","60.0","nan","1"
"143","Monolocale via Luigi Galvani, Borgo Nuovo - Navigatori, Verona","400.0","nan","45.0","nan","1"
"144","Bilocale viale Venezia 89, Borgo Venezia, Verona","600.0","2","65.0","nan","1"
"145","Monolocale via Fiumicello, Borgo Venezia, Verona","450.0","nan","35.0","nan","1"
"146","Bilocale piazza delle Pasque Veronesi, Centro Storico, Verona","750.0","2","62.0","nan","1"
"147","Appartamento via Prato Santo, Borgo Trento, Verona","1750.0","5","190.0","2","1"
"148","Trilocale via Santini, Pindemonte, Verona","800.0","3","100.0","nan","1"
"149","Quadrilocale piazza dei Caduti, Santa Lucia - Golosine, Verona","800.0","4","110.0","nan","1"
"150","Bilocale via Legnago, Borgo Roma, Verona","550.0","2","50.0","nan","1"
"151","Trilocale via Sommacampagna, Santa Lucia - Golosine, Verona","650.0","3","70.0","nan","1"
"152","Quadrilocale via Santini, Pindemonte, Verona","800.0","4","100.0","nan","1"
"153","Trilocale via Porto San Pancrazio, Porto San Pancrazio, Verona","700.0","3","70.0","nan","1"
"154","Trilocale ottimo stato, primo piano, Borgo Trento, Verona","900.0","3","66.0","2","1"
"155","Bilocale via Mincio, Santa Lucia - Golosine, Verona","500.0","2","55.0","nan","1"
"156","Appartamento via Ponte Pietra 18, Centro Storico, Verona","1700.0","5","160.0","3","1"
"157","Bilocale Scaletta San Marco, Centro Storico, Verona","1000.0","2","50.0","nan","1"
"158","Trilocale via Santini, Pindemonte, Verona","900.0","3","100.0","nan","1"
"159","Monolocale via Roveggia, Zona Fiera, Verona","600.0","nan","35.0","nan","1"
"160","Trilocale ottimo stato, quarto piano, Stadio, Verona","720.0","3","55.0","nan","1"
"161","Quadrilocale via Arcole, Cà di David, Verona","670.0","4","125.0","2","1"
"162","Bilocale via Bolzano, Borgo Roma, Verona","690.0","2","70.0","nan","1"
"163","Trilocale corso Milano, Borgo Milano, Verona","650.0","3","90.0","nan","1"
"164","Monolocale via Legnago, Borgo Roma, Verona","500.0","nan","40.0","nan","1"
"165","Bilocale via Laghetto Squarà, Montorio, Verona","650.0","2","65.0","nan","1"
"166","Mansarda ottimo stato, 56 m², Centro Storico, Verona","1200.0","2","56.0","nan","1"
"167","Trilocale via Cesiolo, Pindemonte, Verona","800.0","3","100.0","nan","1"
"168","Bilocale via Cappello, Centro Storico, Verona","680.0","2","40.0","nan","1"
"169","Bilocale viale Andrea Palladio, Stadio, Verona","580.0","2","60.0","nan","1"
"170","Trilocale via Porto San Pancrazio, Porto San Pancrazio, Verona","700.0","3","80.0","nan","1"
"171","Trilocale buono stato, quarto piano, Borgo Trento, Verona","1400.0","3","147.0","2","1"
"172","Villa unifamiliare, ottimo stato, 85 m², Quinzano, Verona","1300.0","4","85.0","nan","1"
"173","Bilocale via centro, Borgo Roma, Verona","650.0","2","40.0","nan","1"
"174","Villa unifamiliare, buono stato, 450 m², Borgo Venezia, Verona","3500.0","5+","450.0","3+","1"
"175","Quadrilocale via Andrea Doria 41, Borgo Nuovo - Navigatori, Verona","700.0","4","82.0","nan","1"
"176","Monolocale via Santa Chiara, Veronetta, Verona","750.0","nan","30.0","nan","1"
"177","Trilocale via Porto San Pancrazio, Porto San Pancrazio, Verona","600.0","3","85.0","nan","1"
"178","Appartamento buono stato, primo piano, San Massimo - Croce Bianca, Verona","790.0","5","140.0","nan","1"
"179","Trilocale ottimo stato, piano rialzato, Centro Storico, Verona","1250.0","3","100.0","2","1"
"180","Monolocale via Pitagora, Borgo Nuovo - Navigatori, Verona","400.0","nan","30.0","nan","1"
"181","Bilocale corso Milano, Borgo Milano, Verona","600.0","2","70.0","nan","1"
"182","Trilocale Galleria Pellicciai 9, Centro Storico, Verona","1200.0","3","95.0","nan","1"
"183","Monolocale ottimo stato, primo piano, Cà di David, Verona","500.0","nan","62.0","nan","1"
"184","Trilocale via Torricelle, Torricelle, Verona","1190.0","3","90.0","2","1"
"185","Bilocale buono stato, secondo piano, Avesa, Verona","650.0","2","10.0","nan","1"
"186","Bilocale ottimo stato, Zona Fiera, Verona","9000.0","2","50.0","nan","1"
"187","Appartamento ottimo stato, primo piano, Borgo Trento, Verona","1500.0","5+","170.0","3","1"
"188","Quadrilocale Lungadige Bartolomeo Rubele, Centro Storico, Verona","1300.0","4","86.0","nan","1"
"189","Quadrilocale via da Monte, Borgo Trento, Verona","1000.0","4","90.0","nan","1"
"190","Quadrilocale buono stato, Ponte Crencano, Verona","750.0","4","100.0","nan","1"
"191","Bilocale via Cappello 5, Centro Storico, Verona","1500.0","2","65.0","nan","1"
"192","Monolocale via San Nazaro, Veronetta, Verona","600.0","nan","77.0","nan","1"
"193","Monolocale via Guglielmo Marconi, Valverde, Verona","460.0","nan","40.0","nan","1"
"194","Bilocale Ponte Scaligero, Verona","600.0","2","50.0","nan","1"
"195","Appartamento piazza Bra, Centro Storico, Verona","2200.0","5","250.0","2","1"
"196","Quadrilocale ottimo stato, sesto piano, Centro Storico, Verona","1500.0","4","100.0","2","1"
"197","Appartamento ottimo stato, primo piano, Borgo Milano, Verona","3700.0","5+","400.0","nan","1"
"198","Monolocale via Valpolicella, Parona, Verona","650.0","nan","nan","nan","1"
"199","Monolocale via dei Mutilati, Valverde, Verona","900.0","nan","nan","nan","1"
"200","Monolocale via Antonio Pisano, Borgo Venezia, Verona","2100.0","nan","nan","nan","1"
"201","Bilocale ottimo stato, primo piano, Borgo Roma, Verona","650.0","2","65.0","nan","1"
"202","Bilocale p.tta Nogara, Verona","950.0","2","60.0","nan","1"
"203","Trilocale ottimo stato, piano terra, Avesa, Verona","1200.0","3","100.0","2","1"
"204","Trilocale buono stato, quinto piano, Borgo Trento, Verona","800.0","3","60.0","nan","1"
"205","Bilocale piazza San Zeno, San Zeno, Verona","900.0","2","60.0","nan","1"
"206","Appartamento via Sant'Eufemia, Centro Storico, Verona","2000.0","5","180.0","3","1"
"207","Appartamento ottimo stato, terzo piano, Centro Storico, Verona","2500.0","5","158.0","3","1"
"208","Palazzo - Edificio via GOTTARDO 18, San Michele Extra, Verona","8333.0","nan","1.0","nan","1"
"209","Bilocale ottimo stato, primo piano, Centro Storico, Verona","1200.0","2","90.0","nan","1"
"210","Quadrilocale ottimo stato, piano rialzato, Borgo Trento, Verona","1100.0","4","140.0","nan","1"
"211","Bilocale piazza Brà, Centro Storico, Verona","1000.0","2","49.0","nan","1"
"212","Monolocale via Crotone, Borgo Nuovo - Navigatori, Verona","1900.0","nan","nan","nan","1"
"213","Palazzo - Edificio via Albere, Stadio, Verona","nan","nan","3.22","nan","1"
"214","Monolocale via Ca' di Cozzi, Ponte Crencano, Verona","1900.0","nan","nan","nan","1"
"215","Villa unifamiliare, buono stato, 150 m², San Zeno, Verona","2500.0","5","150.0","2","1"
"216","Quadrilocale buono stato, ammezzato, Centro Storico, Verona","1000.0","4","80.0","nan","1"
"217","Appartamento ottimo stato, secondo piano, Centro Storico, Verona","nan","5","410.0","3","1"
"218","Trilocale sant eufemia, Verona","850.0","3","78.0","nan","1"
"219","Bilocale piazza Brà, Centro Storico, Verona","1100.0","2","70.0","nan","1"
"220","Appartamento via Legnago, Borgo Roma, Verona","500.0","nan","21.0","nan","1"
"221","Quadrilocale via della Costa 3, Centro Storico, Verona","2900.0","4","90.0","nan","1"
"222","Monolocale via Valdonega 60, Valdonega, Verona","450.0","nan","30.0","nan","1"
"223","Appartamento via Canale Milani 14, Cà di David, Verona","1350.0","5","125.0","3","1"
"224","Quadrilocale via Urbano III 8, San Massimo - Croce Bianca, Verona","850.0","4","110.0","2","1"
"225","Bilocale via della Costa 3, Centro Storico, Verona","1450.0","2","50.0","nan","1"
"226","Monolocale via Franco Maria Cattarinetti 1B, Zona Fiera, Verona","750.0","nan","14.0","nan","4"
"227","Bilocale via Legnago 39, Borgo Roma, Verona","700.0","2","55.0","nan","4"
"228","Monolocale via Ponte Pietra 9, Centro Storico, Verona","800.0","nan","70.0","nan","4"
"229","Appartamento in villa via della Pace 5, Pindemonte, Verona","500.0","nan","150.0","nan","4"
"230","Trilocale via della Valverde, Valverde, Verona","950.0","3","80.0","nan","4"
"231","Trilocale via Napoleone I, Borgo Nuovo - Navigatori, Verona","750.0","3","75.0","nan","4"
"232","Quadrilocale via Brenta 5, Zona Fiera, Verona","700.0","4","88.0","nan","4"
"233","Trilocale via Giorgione 5, Stadio, Verona","1000.0","3","80.0","nan","4"
"234","Bilocale via Bartolomeo Bacilieri 8, San Massimo - Croce Bianca, Verona","750.0","2","50.0","nan","4"
"235","Appartamento via Fratelli Bronzetti 7, Pindemonte, Verona","1400.0","5","132.0","2","4"
"236","Bilocale via 4 Novembre 14, Borgo Trento, Verona","1500.0","2","60.0","nan","4"
"237","Mansarda via Trento 11, Ponte Crencano, Verona","750.0","nan","50.0","nan","4"
"238","Trilocale via Caserma Ospital Vecchio 6, Cittadella - Porta Nuova, Verona","850.0","3","120.0","nan","4"
"239","Trilocale via centro 25, Borgo Roma, Verona","1180.0","3","75.0","nan","4"
"240","Appartamento via Giovanna Murari Brà 8, Zona Fiera, Verona","1500.0","nan","50.0","nan","4"
"241","Bilocale via Madonna del Terraglio 17, Veronetta, Verona","600.0","2","50.0","nan","4"
"242","Monolocale piazzale Buccari 1, Montorio, Verona","450.0","nan","35.0","nan","4"
"243","Quadrilocale via Colli Berici 2, San Michele Extra, Verona","900.0","4","110.0","nan","4"
"244","Bilocale via Don Giacomo Trevisani 10, San Massimo - Croce Bianca, Verona","430.0","2","35.0","nan","4"
"245","Bilocale via Giovanni della Casa 1, Valverde, Verona","530.0","2","39.0","nan","4"
"246","Bilocale via Palazzina, Borgo Roma, Verona","750.0","2","75.0","nan","4"
