"Index","Title description","Price","N_rooms","Surface","N_toilettes","Floor"
"1","Attico via Ugo Bassi 66, San Martino, Messina","500.0","nan","26.0","nan","4"
"2","Trilocale via Elisabetta Conci 2, Ganzirri, Messina","2500.0","3","120.0","nan","4"
"3","Trilocale via Nilde Lotti 6 6, Ganzirri, Messina","200.0","3","130.0","nan","4"
"4","Monolocale via Archimede 99, Faro Superiore - Sperone, Messina","300.0","nan","36.0","nan","4"
"5","Trilocale via Marina Ganzirri 12, Ganzirri, Messina","580.0","3","45.0","nan","4"
"6","Trilocale via Nilde Lotti 6 6, Ganzirri, Messina","2000.0","3","130.0","nan","4"
"7","Attico via Nino Bixio, 7, La Farina - Stazione, Messina","850.0","3","70.0","nan","4"
"8","Trilocale via dei Mille 271, San Martino, Messina","600.0","3","95.0","nan","4"
"9","Villa unifamiliare SS 113 Timpazzi 14600, Mortelle - Casa Bianca, Messina","3000.0","4","204.0","2","4"
"10","Appartamento via Sant'Agostino 4, Centro Storico, Messina","3500.0","5+","343.0","2","4"
"11","Trilocale via Oratorio San Francesco, Centro Storico, Messina","1200.0","3","128.0","2","4"
"12","Bilocale via Cernaia 3, Battisti - Avignone, Messina","550.0","2","35.0","nan","4"
"13","Trilocale via Cernaia 3, Battisti - Avignone, Messina","750.0","3","90.0","nan","4"
"14","Quadrilocale via dei Mille 277, San Martino, Messina","700.0","4","160.0","nan","4"
"15","Appartamento salita Villa Contino, Villaggio Santo, Messina","650.0","5","135.0","2","4"
"16","Villa bifamiliare SS113dir, Ortoliuzzo - San Saba, Messina","6800.0","5+","280.0","3+","4"
"17","Trilocale salita Montesanto Contrada Petrazza 22, Camaro Inferiore, Messina","500.0","3","90.0","nan","4"
"18","Trilocale via Antonello Freri 30, Provinciale, Messina","250.0","3","90.0","nan","4"
"19","Appartamento da ristrutturare, piano terra, Briga - Ponte Schiavo, Messina","2000.0","5","260.0","3+","4"
"20","Quadrilocale via Enzo Geraci 23/F, San Martino, Messina","700.0","4","120.0","nan","4"
"21","Trilocale viale Principe Umberto, Gravitelli, Messina","650.0","3","85.0","nan","4"
"22","Monolocale via Don Giovanni Minzoni 7, Tirone, Messina","250.0","nan","20.0","2","4"
"23","Attico via Giuseppe la Farina 135, La Farina - Stazione, Messina","850.0","3","79.0","nan","4"
"24","Trilocale via San Sebastiano 25, Centro Storico, Messina","700.0","3","120.0","2","4"
"25","Mansarda via Marco Polo 324, Contesse, Messina","660.0","2","69.0","nan","4"
"26","Mansarda via Risorgimento 38, San Martino, Messina","500.0","2","50.0","nan","3"
"27","Trilocale via Stagno 1, Minissale, Messina","550.0","3","72.0","nan","3"
"28","Appartamento viale San Martino 334, Quartiere Lombardo, Messina","950.0","nan","120.0","nan","3"
"29","Trilocale via Santa Cecilia 47, San Martino, Messina","900.0","3","110.0","2","3"
"30","Bilocale viale Teodoro Roosevelt 11, Quartiere Americano, Messina","350.0","2","38.0","nan","3"
"31","Appartamento via Fata Morgana 1, Garibaldi, Messina","650.0","5","130.0","2","3"
"32","Bilocale via Nazionale Galati Marina 48, Galati, Messina","500.0","2","60.0","nan","3"
"33","Bilocale via Torre Bianca 55, Torre Faro, Messina","450.0","2","65.0","nan","3"
"34","Bilocale via Solferino 9, Centro Storico, Messina","500.0","2","50.0","nan","3"
"35","Quadrilocale via Consolare Pompea 258, Ganzirri, Messina","750.0","4","100.0","nan","3"
"36","Bilocale via Torre Bianca 55, Torre Faro, Messina","1800.0","2","65.0","nan","3"
"37","Quadrilocale via Cesare Battisti 214, Battisti - Avignone, Messina","750.0","4","107.0","nan","3"
"38","Trilocale corso Camillo Benso di Cavour 179, Centro Storico, Messina","850.0","3","100.0","nan","3"
"39","Trilocale via Muzio Attendolo Sforza 5, Minissale, Messina","470.0","3","90.0","nan","3"
"40","Appartamento via San Sebastiano 13, Centro Storico, Messina","700.0","5","125.0","2","3"
"41","Quadrilocale via cesare battisti 226, Battisti - Avignone, Messina","210.0","4","14.0","nan","3"
"42","Bilocale via Isarco, Principe Umberto, Messina","550.0","2","100.0","nan","3"
"43","Quadrilocale via Risorgimento, San Martino, Messina","800.0","4","100.0","2","3"
"44","Trilocale via Antonio Catara Lettieri 4, Camaro Inferiore, Messina","500.0","3","77.0","nan","3"
"45","Trilocale via san giuseppe , 7, Centro Storico, Messina","1000.0","3","70.0","2","3"
"46","Mansarda via Risorgimento 38, San Martino, Messina","500.0","2","40.0","nan","3"
"47","Trilocale Strada Statale Orientale Sicula 10, Tremestieri - Pistunina, Messina","750.0","3","95.0","2","3"
"48","Quadrilocale via Industriale, La Farina - Stazione, Messina","650.0","4","141.0","2","3"
"49","Bilocale via Tommaso Cannizzaro 58, Centro Storico, Messina","570.0","2","40.0","nan","3"
"50","Mansarda via Marco Polo 438, Contesse, Messina","400.0","3","65.0","nan","3"
"51","Appartamento via 1 Settembre 73, Centro Storico, Messina","2000.0","5","200.0","3+","2"
"52","Trilocale via Torre Bianca 59, Torre Faro, Messina","450.0","3","80.0","nan","2"
"53","Trilocale via Adolfo Celi, 46, 98125 Contesse ME, Santa Lucia - San Filippo, Messina","520.0","3","99.0","nan","2"
"54","Bilocale Giampilieri superiore ,, Giampilieri, Messina","450.0","2","65.0","nan","2"
"55","Monolocale via Santa Maria Alemanna, Centro Storico, Messina","560.0","nan","40.0","nan","2"
"56","Trilocale via Nazionale, Mili, Messina","550.0","3","90.0","2","2"
"57","Appartamento via Reggio Calabria 67, Provinciale, Messina","220.0","5","16.0","nan","2"
"58","Bilocale via Risorgimento 172, San Martino, Messina","600.0","2","60.0","nan","2"
"59","Trilocale via Giuseppe La Farina, La Farina - Stazione, Messina","600.0","3","75.0","nan","2"
"60","Trilocale via Tommaso Cannizzaro 16/B, Centro Storico, Messina","600.0","3","124.0","nan","2"
"61","Quadrilocale Strada Panoramica dello Stretto 574, Litoranea - Panoramica, Messina","900.0","4","133.0","2","2"
"62","Monolocale via San Crispino e Crispiniano, Regina Margherita - Torrente Trapani, Messina","200.0","nan","25.0","nan","2"
"63","Appartamento via 24 Maggio, Centro Storico, Messina","550.0","5","130.0","nan","2"
"64","Quadrilocale via Nicola Fabrizi 13, San Martino, Messina","580.0","4","95.0","nan","2"
"65","Trilocale viale San Martino 249, San Martino, Messina","550.0","3","60.0","nan","2"
"66","Bilocale Briga Marina, Briga - Ponte Schiavo, Messina","380.0","2","70.0","nan","2"
"67","Trilocale via Antonio Salandra 19, Quartiere Americano, Messina","450.0","3","60.0","nan","2"
"68","Quadrilocale via Francesco Denaro, Ganzirri, Messina","800.0","4","115.0","2","2"
"69","Bilocale via Giuseppe Garibaldi 150, Garibaldi, Messina","800.0","2","95.0","nan","2"
"70","Quadrilocale via Antonio Canova 8, Garibaldi, Messina","800.0","4","130.0","2","2"
"71","Trilocale via Consolare Pompea 419, Litoranea - Panoramica, Messina","nan","3","62.0","nan","2"
"72","Appartamento via tranquilla 11, Provinciale, Messina","220.0","5+","20.0","nan","2"
"73","Monolocale viale principe umberto 40, Principe Umberto, Messina","600.0","nan","65.0","nan","2"
"74","Quadrilocale largo Seggiola, Battisti - Avignone, Messina","2500.0","4","165.0","3+","2"
"75","Trilocale via Eduardo Giacomo Boner ,, Garibaldi, Messina","550.0","3","65.0","nan","2"
"76","Trilocale via Lungomare 67, Ortoliuzzo - San Saba, Messina","nan","3","55.0","nan","2"
"77","Appartamento via argentieri 32, Centro Storico, Messina","nan","5+","390.0","3","2"
"78","Appartamento via Nina da Messina sn, Garibaldi, Messina","950.0","5","179.0","2","2"
"79","Trilocale via dei Mille 243, San Martino, Messina","950.0","3","110.0","nan","2"
"80","Monolocale viale Annunziata 110, Annunziata Bassa, Messina","350.0","nan","38.0","nan","2"
"81","Trilocale piazza Della Palestra Comunale, 57, Viale Italia - Montepiselli, Messina","600.0","3","85.0","nan","2"
"82","Quadrilocale via XXIV MAGGIO, 21, Centro Storico, Messina","850.0","4","117.0","2","2"
"83","Bilocale via Consolare Pompea 2061, Faro Superiore - Sperone, Messina","1200.0","2","80.0","nan","2"
"84","Quadrilocale via Centonze 25, San Martino, Messina","200.0","4","110.0","2","2"
"85","Quadrilocale via Dogali, San Martino, Messina","600.0","4","80.0","nan","2"
"86","Villa unifamiliare Strada Panoramica dello Stretto 1000, Litoranea - Panoramica, Messina","8000.0","5+","773.0","nan","2"
"87","Bilocale viale Annunziata 110, Annunziata Bassa, Messina","450.0","2","55.0","nan","2"
"88","Trilocale via stazione giampileri, Galati, Messina","600.0","3","201.0","nan","2"
"89","Appartamento buono stato, secondo piano, San Martino, Messina","1200.0","5+","220.0","3","2"
"90","Bilocale via Giuseppe Garibaldi, Libertà, Messina","550.0","2","68.0","nan","2"
"91","Quadrilocale via Nino Bixio, San Martino, Messina","800.0","4","154.0","2","2"
"92","Bilocale via Giuseppe Natoli 100, San Martino, Messina","520.0","2","80.0","nan","2"
"93","Appartamento via Maddalena, San Martino, Messina","650.0","5","140.0","2","2"
"94","Monolocale via Luigi Cadorna, Tirone, Messina","300.0","nan","25.0","nan","2"
"95","Bilocale piazza Duomo, Centro Storico, Messina","400.0","2","55.0","nan","2"
"96","Trilocale via Torre Bianca 6, Torre Faro, Messina","3500.0","3","70.0","nan","2"
"97","Attico via 27 Luglio 100, Battisti - Avignone, Messina","800.0","2","60.0","nan","2"
"98","Trilocale via Palermo, Giostra, Messina","400.0","3","95.0","nan","2"
"99","Bilocale strada provinciale 38, 20, Mili, Messina","370.0","2","55.0","nan","2"
"100","Bilocale via Gagini 6, Regina Margherita - Torrente Trapani, Messina","550.0","2","70.0","nan","2"
"101","Quadrilocale via dei Mille 89, San Martino, Messina","550.0","4","90.0","nan","1"
"102","Appartamento Strada Panoramica dello Stretto 574, Litoranea - Panoramica, Messina","700.0","5","160.0","2","1"
"103","Quadrilocale via Ettore Lombardo Pellegrino, 26, San Martino, Messina","850.0","4","140.0","2","1"
"104","Trilocale via Catania 469/Pal.Palano, Provinciale, Messina","700.0","3","115.0","nan","1"
"105","Quadrilocale via Geraci, Battisti - Avignone, Messina","700.0","4","110.0","nan","1"
"106","Trilocale discesa Corsari, Acqualadrone - Spartà, Messina","450.0","3","255.0","nan","1"
"107","Appartamento via del Vespro 98122 Messina Sicilia Italia, Centro Storico, Messina","4000.0","5+","400.0","2","1"
"108","Villa unifamiliare viale Boccetta ,, Regina Margherita - Torrente Trapani, Messina","6500.0","5+","800.0","3+","1"
"109","Trilocale via Pietro Castelli 9, Gravitelli, Messina","450.0","3","70.0","nan","1"
"110","Quadrilocale via nazionale , 81, Santa Margherita - Santo Stefano, Messina","500.0","4","120.0","2","1"
"111","Bilocale via Primo Palazzo, Torre Faro, Messina","1800.0","2","48.0","nan","1"
"112","Bilocale via degli Etruschi, Ganzirri, Messina","2200.0","2","71.0","nan","1"
"113","Bilocale via degli Etruschi, Ganzirri, Messina","700.0","2","50.0","nan","1"
"114","Bilocale via del Santo 45, Villaggio Santo, Messina","370.0","2","60.0","nan","1"
"115","Attico Strada Comunale Sperone 63, Faro Superiore - Sperone, Messina","250.0","4","95.0","2","1"
"116","Trilocale via Ugo Bassi 30, San Martino, Messina","1000.0","3","83.0","nan","1"
"117","Trilocale via Alfredo Cappellini 14, Regina Margherita - Torrente Trapani, Messina","600.0","3","95.0","nan","1"
"118","Bilocale via Ettore Lombardo Pellegrino ,, San Martino, Messina","600.0","2","80.0","nan","1"
"119","Quadrilocale via degli Orti 19, Gonzaga, Messina","650.0","4","105.0","2","1"
"120","Appartamento viale Regina Elena 107, Libertà, Messina","800.0","5","145.0","2","1"
"121","Appartamento via Monsignor Letterio d'Arrigo, Garibaldi, Messina","1250.0","5+","218.0","nan","1"
"122","Appartamento via Pozzo Leone, 5, Centro Storico, Messina","1000.0","5","180.0","2","1"
"123","Monolocale ottimo stato, piano rialzato, Messina","500.0","nan","30.0","nan","1"
"124","Open space via Giacomo Venezian, Centro Storico, Messina","750.0","nan","50.0","nan","1"
"125","Bilocale viale Principe Umberto 89, Principe Umberto, Messina","550.0","2","50.0","nan","1"
"126","Mansarda buono stato, 40 m², Faro Superiore - Sperone, Messina","320.0","2","40.0","nan","1"
"127","Bilocale Strada Statale Tono, Acqualadrone - Spartà, Messina","nan","2","50.0","nan","1"
"128","Quadrilocale via Ducezio, 70, Gravitelli, Messina","nan","4","140.0","2","1"
"129","Trilocale via Garibaldi 126, Centro Storico, Messina","1000.0","3","100.0","2","1"
"130","Bilocale via Marina Orto Liuzzo 8/13, Ortoliuzzo - San Saba, Messina","1400.0","2","51.0","nan","1"
"131","Appartamento viale Cadorna 30, Tirone, Messina","300.0","5","169.0","2","1"
"132","Bilocale via Antonio Salandra, Quartiere Americano, Messina","500.0","2","60.0","nan","1"
"133","Appartamento via Tommaso Cannizzaro 200, Centro Storico, Messina","650.0","5","130.0","nan","1"
"134","Quadrilocale via Ducezio 70, Gravitelli, Messina","nan","4","140.0","2","1"
"135","Quadrilocale via La Farina ,, Quartiere Americano, Messina","550.0","4","100.0","nan","1"
"136","Monolocale fondachello, Messina","1000.0","nan","35.0","nan","1"
"137","Appartamento via Uberto Bonino 21, Gazzi, Messina","700.0","5","100.0","2","1"
"138","Monolocale via Torino, La Farina - Stazione, Messina","350.0","nan","35.0","nan","1"
"139","Trilocale viale Europa, 64, San Martino, Messina","380.0","3","70.0","nan","1"
"140","Appartamento via XXIV Maggio ,, Centro Storico, Messina","1200.0","5+","180.0","nan","1"
"141","Villa bifamiliare, buono stato, 150 m², Faro Superiore - Sperone, Messina","750.0","4","150.0","2","1"
"142","Trilocale 70 m², Tirone, Messina","350.0","3","70.0","nan","1"
"143","Appartamento piazza Basicò ,, Centro Storico, Messina","nan","5+","800.0","nan","1"
"144","Quadrilocale viale dei Tigli 10, Litoranea - Panoramica, Messina","200.0","4","130.0","2","1"
"145","Quadrilocale via Palermo 503, Giostra, Messina","500.0","4","118.0","2","1"
"146","Mansarda Contrada Mortelle 26, Torre Faro, Messina","nan","3","75.0","nan","1"
"147","Bilocale Contrada Ponte Schiavo 294, Santa Margherita - Santo Stefano, Messina","400.0","2","68.0","nan","1"
"148","Bilocale piazza Donato 17, Ganzirri, Messina","1500.0","2","50.0","nan","1"
"149","Bilocale via Risorgimento 38, San Martino, Messina","550.0","2","40.0","nan","1"
"150","Appartamento via 24 Maggio, Centro Storico, Messina","1350.0","5+","170.0","nan","1"
"151","Trilocale via Panoramica dello Stretto 1330, Litoranea - Panoramica, Messina","700.0","3","110.0","2","5"
"152","Bilocale via Marco Polo 10, Minissale, Messina","450.0","2","65.0","nan","5"
"153","Terratetto unifamiliare Strada Statale Spartà, Acqualadrone - Spartà, Messina","2500.0","3","87.0","2","5"
"154","Trilocale via Primo Palazzo 136, Torre Faro, Messina","2600.0","3","100.0","2","5"
"155","Trilocale via Noviziato Casazza 71, Viale Italia - Montepiselli, Messina","400.0","3","110.0","nan","5"
"156","Bilocale via Acqua del Conte 6, Tirone, Messina","540.0","2","70.0","nan","5"
"157","Trilocale via Eduardo Giacomo Boner 48, Garibaldi, Messina","690.0","3","130.0","2","5"
"158","Quadrilocale via Gelone 7, Viale Italia - Montepiselli, Messina","520.0","4","108.0","nan","5"
"159","Trilocale via Felice Bisazza 21, Centro Storico, Messina","750.0","3","90.0","nan","5"
"160","Trilocale via Lungomare in San Saba 63, Ortoliuzzo - San Saba, Messina","550.0","3","90.0","nan","5"
"161","Trilocale via Consolare Pompea, Litoranea - Panoramica, Messina","800.0","3","100.0","nan","5"
"162","Attico via Lungomare in San Saba, Ortoliuzzo - San Saba, Messina","650.0","3","80.0","nan","5"
"163","Bilocale via Comunale Santo 166, Gazzi, Messina","350.0","2","73.0","nan","5"
"164","Trilocale via Terzo Palazzo 198, Torre Faro, Messina","2900.0","3","105.0","3","5"
"165","Trilocale via Placida 32, Garibaldi, Messina","950.0","3","110.0","2","5"
"166","Quadrilocale via 1 Settembre 37, Centro Storico, Messina","800.0","4","110.0","2","5"
"167","Trilocale viale Regina Margherita 59, Regina Margherita - Torrente Trapani, Messina","650.0","3","148.0","2","5"
"168","Trilocale via Umberto Terracini 20, Annunziata Alta, Messina","700.0","3","70.0","nan","5"
"169","Trilocale via del Fante 90, Annunziata Bassa, Messina","350.0","3","105.0","2","5"
"170","Quadrilocale via Ernesto Cianciolo, Bordonaro - Cumia, Messina","700.0","4","100.0","2","5"
"171","Bilocale via San Filippo Bianchi 23, Centro Storico, Messina","1100.0","2","60.0","nan","5"
"172","Trilocale Contrada Piano Torre 98163, Acqualadrone - Spartà, Messina","450.0","3","95.0","nan","5"
"173","Villa plurifamiliare via Consolare Pompea 200, Sant'Agata, Messina","900.0","5","120.0","2","5"
"174","Bilocale via Giuseppe Garibaldi, Centro Storico, Messina","650.0","2","65.0","nan","5"
"175","Trilocale largo Vincenzo la Rosa 81, Minissale, Messina","600.0","3","95.0","nan","5"
"176","Appartamento in villa Sp51, Ortoliuzzo - San Saba, Messina","1400.0","nan","45.0","nan","3"
"177","Quadrilocale via Gerobino Pilli 47, Camaro Inferiore, Messina","600.0","4","90.0","nan","3"
"178","Bilocale Contrada Mezzacampa 18, Ortoliuzzo - San Saba, Messina","1800.0","2","80.0","nan","3"
"179","Appartamento via Cumia 12, Bordonaro - Cumia, Messina","395.0","nan","110.0","nan","3"
"180","Bilocale via Consolare Pompea 5, Litoranea - Panoramica, Messina","750.0","2","80.0","nan","3"
"181","Trilocale via dei Mille 145, San Martino, Messina","750.0","3","80.0","nan","3"
"182","Appartamento via Dogali 10, San Martino, Messina","850.0","nan","80.0","2","3"
"183","Trilocale via Domenico Lisciotto, Ganzirri, Messina","400.0","3","85.0","2","3"
"184","Bilocale via Marco Polo 10, Minissale, Messina","450.0","2","60.0","nan","3"
"185","Bilocale via Comunale Catarratti 30, Camaro Superiore, Messina","350.0","2","50.0","nan","3"
"186","Appartamento via Principessa Mafalda 34, Libertà, Messina","200.0","nan","120.0","nan","3"
"187","Mansarda via Ernesto Cianciolo, Bordonaro - Cumia, Messina","350.0","2","50.0","nan","3"
"188","Appartamento Svincolo Torrente Guardia, Sant'Agata, Messina","650.0","nan","60.0","nan","3"
"189","Bilocale via Acqua del Conte, Tirone, Messina","540.0","2","71.0","nan","3"
"190","Quadrilocale via Principe Ruffo 5, Giostra, Messina","600.0","4","110.0","2","3"
"191","Trilocale via Consolare Valeria 458, Tremestieri - Pistunina, Messina","400.0","3","95.0","nan","3"
"192","Bilocale via Ugo Bassi 28, San Martino, Messina","600.0","2","45.0","nan","3"
"193","Bilocale via Consolare Valeria 51, Minissale, Messina","700.0","2","60.0","nan","3"
"194","Appartamento in villa Contrada Policara 23, Ortoliuzzo - San Saba, Messina","400.0","2","50.0","nan","3"
"195","Soffitta via Acqua del Conte 2, Tirone, Messina","100.0","nan","36.0","nan","3"
"196","Bilocale via Palermo 481, Giostra, Messina","400.0","2","50.0","nan","3"
"197","Palazzo - Edificio viale Annunziata, Annunziata Bassa, Messina","400.0","2","50.0","nan","3"
"198","Bilocale via Attilio Gasparro 20, Centro Storico, Messina","550.0","2","40.0","nan","3"
"199","Trilocale via Elisabetta Conci 5, Ganzirri, Messina","2000.0","3","100.0","nan","3"
