"Index","Title description","Price","N_rooms","Surface","N_toilettes","Floor"
"1","Bilocale via Edward Jenner, Ospedale - Volturno, Parma","550.0","2","55.0","nan","2"
"2","Bilocale via Francesco Leporati, Ospedale - Volturno, Parma","550.0","2","70.0","nan","2"
"3","Bilocale via Dalmazia, Centro Storico, Parma","500.0","2","50.0","nan","2"
"4","Trilocale Borgo 20 Marzo, Centro Storico, Parma","1000.0","3","100.0","nan","2"
"5","Trilocale via Albert Einstein, San Lazzaro, Parma","1000.0","3","95.0","nan","2"
"6","Bilocale viale Arturo Toscanini, Centro Storico, Parma","500.0","2","50.0","nan","2"
"7","Trilocale piazza Caduti del Lavoro, Ospedale - Volturno, Parma","250.0","3","120.0","nan","2"
"8","Quadrilocale Strada Felice Cavallotti, Centro Storico, Parma","2500.0","4","263.0","3","2"
"9","Bilocale Strada Naviglio Alto, Paradigna - Centro Torri, Parma","649.0","2","65.0","nan","2"
"10","Monolocale via Toscana, San Lazzaro, Parma","400.0","nan","36.0","nan","2"
"11","Trilocale via Indro Montanelli, Manara - Cavagnari, Parma","600.0","3","75.0","nan","2"
"12","Monolocale Strada Nino Bixio, Parco Ducale - Oltretorrente, Parma","500.0","nan","25.0","nan","2"
"13","Bilocale via Alberto Riva, Parco Ducale - Oltretorrente, Parma","450.0","2","40.0","nan","2"
"14","Trilocale Borgo Mameli, Centro Storico, Parma","1800.0","3","105.0","2","2"
"15","Trilocale via Giuseppe Verdi, Centro Storico, Parma","1250.0","3","120.0","2","2"
"16","Bilocale via Carlo Majorano 6, Ospedale - Volturno, Parma","800.0","2","55.0","nan","2"
"17","Trilocale via Emilia Est 54, San Lazzaro, Parma","1050.0","3","80.0","2","2"
"18","Trilocale via Emilia Est 54, San Lazzaro, Parma","1050.0","3","80.0","2","2"
"19","Bilocale via Emilia Est 54, San Lazzaro, Parma","850.0","2","68.0","nan","2"
"20","Trilocale via Venezia, San Leonardo, Parma","1350.0","3","106.0","2","2"
"21","Trilocale Str. Nino Bixio 41, Parco Ducale - Oltretorrente, Parma","1200.0","3","90.0","2","2"
"22","Trilocale Borgo Amadio Ronchini, Centro Storico, Parma","1500.0","3","105.0","2","2"
"23","Trilocale piazzale Vittorio Emanuele II 19, San Lazzaro, Parma","1500.0","3","150.0","2","2"
"24","Bilocale piazzale Vittorio Emanuele II 19, San Lazzaro, Parma","1300.0","2","80.0","nan","2"
"25","Bilocale Borgo delle Colonne 22, Centro Storico, Parma","760.0","2","50.0","nan","2"
"26","Mansarda Strada Petrarca, Centro Storico, Parma","1300.0","4","110.0","2","3"
"27","Quadrilocale via Emilio Lepido, San Lazzaro, Parma","900.0","4","105.0","nan","3"
"28","Monolocale via Mantova 201, San Prospero, Parma","450.0","nan","35.0","nan","3"
"29","Trilocale via Osacca 13, Pablo - Prati Bocchi, Parma","900.0","3","85.0","nan","3"
"30","Monolocale viale Piacenza, Pablo - Prati Bocchi, Parma","700.0","nan","27.0","nan","3"
"31","Bilocale Strada Farini 23, Centro Storico, Parma","850.0","2","50.0","nan","3"
"32","Bilocale Borgo Naviglio 32, Centro Storico, Parma","950.0","2","48.0","nan","3"
"33","Appartamento Str. Farnese 39, Montanara - Cinghio, Parma","1150.0","5+","135.0","2","3"
"34","Appartamento Strada dell'Università 4, Centro Storico, Parma","1800.0","5+","160.0","2","3"
"35","Terratetto plurifamiliare via Osteria Fochi 15, Botteghino - Pilastrello, Parma","1500.0","4","120.0","3","3"
"36","Bilocale Borgo Delle Colonne, Centro Storico, Parma","nan","2","40.0","nan","3"
"37","Bilocale via Battaglia di Fornovo 14, Pablo - Prati Bocchi, Parma","1000.0","2","65.0","nan","3"
"38","Appartamento viale Antonio Bizzozero 7, Stadio - Cittadella, Parma","1500.0","5","190.0","2","3"
"39","Bilocale via Vincenzo Mistrali, Centro Storico, Parma","650.0","2","55.0","nan","3"
"40","Monolocale Borgo Bernabei 56, San Lazzaro, Parma","750.0","nan","33.0","nan","3"
"41","Trilocale Strada dell'Università 4, Centro Storico, Parma","1000.0","3","60.0","2","3"
"42","Trilocale viale Martiri della Libertà 45, Stadio - Cittadella, Parma","1100.0","3","80.0","nan","3"
"43","Bilocale via Emilia Est, San Lazzaro, Parma","950.0","2","54.0","nan","3"
"44","Bilocale via Massimo D'Azeglio, Parco Ducale - Oltretorrente, Parma","750.0","2","45.0","nan","3"
"45","Bilocale vicolo Bianchi, Centro Storico, Parma","650.0","2","35.0","nan","3"
"46","Bilocale via Aristo e Giuseppe Isola 43, Ospedale - Volturno, Parma","900.0","2","45.0","nan","3"
"47","Trilocale Strada della Repubblica 5, Centro Storico, Parma","3000.0","3","156.0","2","3"
"48","Bilocale via A. M. Pesenti 3, Ospedale - Volturno, Parma","1100.0","2","50.0","nan","3"
"49","Bilocale Borgo Giacomo Tommasini 13, Centro Storico, Parma","770.0","2","70.0","nan","3"
"50","Bilocale via Emilio Casa, Centro Storico, Parma","570.0","2","45.0","nan","3"
"51","Bilocale Strada Giovanni Inzani, Parco Ducale - Oltretorrente, Parma","750.0","2","45.0","nan","0"
"52","Trilocale via Madre Anna Maria Adorni, Centro Storico, Parma","1100.0","3","135.0","2","0"
"53","Monolocale Borgo Valorio, Centro Storico, Parma","nan","nan","30.0","nan","0"
"54","Appartamento Strada Ritorta, Corcagnano, Parma","2000.0","5","250.0","2","0"
"55","Appartamento Borgo Retto, Centro Storico, Parma","2500.0","5","210.0","3","0"
"56","Trilocale Strada 22 Luglio, Centro Storico, Parma","1100.0","3","106.0","2","0"
"57","Monolocale via corso Corsi, Centro Storico, Parma","nan","nan","30.0","nan","0"
"58","Monolocale Borgo Valorio, Centro Storico, Parma","nan","nan","30.0","nan","0"
"59","Trilocale via Lombardia, Centro Storico, Parma","750.0","3","75.0","2","0"
"60","Bilocale viale Giovanni Falcone 40, San Leonardo, Parma","800.0","2","55.0","nan","0"
"61","Trilocale Strada Nino Bixio 73, Parco Ducale - Oltretorrente, Parma","1100.0","3","73.0","nan","0"
"62","Quadrilocale viale Italo e Cleofonte Campanini, San Lazzaro, Parma","900.0","4","122.0","2","0"
"63","Bilocale Strada Felice Cavallotti 10, Centro Storico, Parma","1100.0","2","60.0","nan","0"
"64","Trilocale Borgo 20 Marzo 1, Centro Storico, Parma","1500.0","3","112.0","2","0"
"65","Bilocale Borgo Canale, Centro Storico, Parma","550.0","2","50.0","nan","0"
"66","Bilocale via I. Cocconi, San Leonardo, Parma","750.0","2","70.0","nan","0"
"67","Trilocale via Bandi 5, Ospedale - Volturno, Parma","1300.0","3","75.0","nan","0"
"68","Bilocale via Emilia Est, San Lazzaro, Parma","950.0","2","55.0","nan","0"
"69","Trilocale Strada Abbeveratoia, Ospedale - Volturno, Parma","1200.0","3","77.0","nan","0"
"70","Appartamento Strada Abbeveratoia 22, Ospedale - Volturno, Parma","300.0","5","100.0","nan","0"
"71","Trilocale Strada Camillo Benso di Cavour, Centro Storico, Parma","1500.0","3","150.0","2","0"
"72","Bilocale via Mario Antonio Pesenti, Ospedale - Volturno, Parma","1100.0","2","64.0","nan","0"
"73","Bilocale via Vincenzo Bellini, Stadio - Cittadella, Parma","1100.0","2","60.0","nan","0"
"74","Mansarda via Vincenzo Bellini, Stadio - Cittadella, Parma","850.0","2","60.0","nan","0"
"75","Villa bifamiliare via Francesco Zanetti, Ospedale - Volturno, Parma","2000.0","5+","350.0","3","0"
"76","Bilocale via Vincenzo Bellini 3, Stadio - Cittadella, Parma","1100.0","2","60.0","nan","2"
"77","Trilocale Strada Matteo Renato Imbriani, Parco Ducale - Oltretorrente, Parma","1100.0","3","90.0","2","2"
"78","Trilocale Strada Aurelio Saffi, 33, Parma Italia, Parma, Parma, 43121, Italia, Centro Storico, Parma","1500.0","3","110.0","nan","2"
"79","Bilocale ottimo stato, secondo piano, Centro Storico, Parma","1300.0","2","70.0","nan","2"
"80","Bilocale viale Giovanni Falcone 44, San Leonardo, Parma","750.0","2","55.0","nan","2"
"81","Monolocale viale villetta, Villetta, Parma","400.0","nan","30.0","nan","2"
"82","Trilocale Strada della Repubblica, Centro Storico, Parma","950.0","3","90.0","2","2"
"83","Quadrilocale via Ciro Menotti, 3, Parma Italia, Parma, Parma, 43125, Italia, Ospedale - Volturno, Parma","1950.0","4","150.0","2","2"
"84","Bilocale Strada Egidio Pini, Ospedale - Volturno, Parma","550.0","2","58.0","nan","2"
"85","Trilocale piazza Giuseppe Garibaldi, Centro Storico, Parma","1600.0","3","100.0","2","2"
"86","Bilocale Borgo 20 Marzo, Centro Storico, Parma","nan","2","80.0","nan","2"
"87","Quadrilocale via Benvenuto Cellini, San Lazzaro, Parma","750.0","4","95.0","nan","2"
"88","Quadrilocale ottimo stato, primo piano, Centro Storico, Parma","1800.0","4","100.0","2","2"
"89","Bilocale Borgo 20 Marzo, Centro Storico, Parma","nan","2","80.0","nan","2"
"90","Trilocale via Jacopo Tintoretto, Montanara - Cinghio, Parma","1100.0","3","96.0","nan","2"
"91","Attico via Padre Lino Maupas 12, Parco Ducale - Oltretorrente, Parma","1200.0","2","70.0","nan","2"
"92","Monolocale via Taro, Villetta, Parma","450.0","nan","40.0","nan","2"
"93","Bilocale Strada Conservatorio, Centro Storico, Parma","800.0","2","50.0","nan","2"
"94","Trilocale via Torrente Gotra, Montanara - Cinghio, Parma","750.0","3","90.0","nan","2"
"95","Bilocale via Brescia, San Leonardo, Parma","670.0","2","45.0","nan","2"
"96","Bilocale Strada Antonio Zarotto, San Lazzaro, Parma","600.0","2","50.0","nan","2"
"97","Attico via Emilia Est, San Lazzaro, Parma","900.0","2","95.0","nan","2"
"98","Bilocale Strada 20 Settembre, Centro Storico, Parma","650.0","2","52.0","nan","2"
"99","Bilocale piazza della Steccata, Centro Storico, Parma","1000.0","2","100.0","nan","2"
"100","Bilocale Carlo Cattaneo, Ospedale - Volturno, Parma","900.0","2","50.0","nan","2"
"101","Quadrilocale via Giovanni Bottesini 4, San Lazzaro, Parma","1000.0","4","103.0","nan","2"
"102","Trilocale Strada Antonio Cocconcelli, Parco Ducale - Oltretorrente, Parma","1200.0","3","80.0","nan","2"
"103","Appartamento Strada Giuseppe Garibaldi 1, Centro Storico, Parma","nan","5","120.0","2","2"
"104","Trilocale via Antonio Gramsci 35, Pablo - Prati Bocchi, Parma","1050.0","3","78.0","nan","2"
"105","Trilocale via Bruno Buozzi, San Pancrazio, Parma","750.0","3","95.0","2","2"
"106","Bilocale Borgo San Silvestro, Centro Storico, Parma","nan","2","65.0","nan","2"
"107","Bilocale via Clemente Bondi 18, San Lazzaro, Parma","600.0","2","55.0","nan","2"
"108","Bilocale via Dalmazia 30, Centro Storico, Parma","700.0","2","40.0","nan","2"
"109","Quadrilocale Stradello Moneglia, Ospedale - Volturno, Parma","1200.0","4","140.0","2","2"
"110","Bilocale ottimo stato, Baganzola - Aeroporto, Parma","600.0","2","50.0","nan","2"
"111","Bilocale Borgo Del Correggio, Centro Storico, Parma","870.0","2","64.0","nan","2"
"112","Trilocale via Nello Brambilla, Stadio - Cittadella, Parma","1050.0","3","80.0","nan","2"
"113","Appartamento via Inigo Campioni 23, Montanara - Cinghio, Parma","1200.0","5","115.0","nan","2"
"114","Bilocale via Costituente, Parco Ducale - Oltretorrente, Parma","520.0","2","50.0","nan","2"
"115","Monolocale buono stato, piano terra, Vigatto, Parma","500.0","nan","29.0","nan","2"
"116","Appartamento via La Spezia, Ospedale - Volturno, Parma","1100.0","5","140.0","2","2"
"117","Quadrilocale Strada Collegio dei Nobili, 3, Centro Storico, Parma","1600.0","4","190.0","2","2"
"118","Trilocale via Giuseppe Verdi, Centro Storico, Parma","1250.0","3","120.0","2","2"
"119","Trilocale buono stato, Baganzola - Aeroporto, Parma","650.0","3","70.0","2","2"
"120","Quadrilocale via Torrente Gotra, Montanara - Cinghio, Parma","750.0","4","80.0","nan","2"
"121","Bilocale ottimo stato, piano rialzato, Montanara - Cinghio, Parma","700.0","2","45.0","nan","2"
"122","Loft via guido gonella , 3, Stadio - Cittadella, Parma","3000.0","4","180.0","2","2"
"123","Bilocale Borgo Santo Spirito, Parco Ducale - Oltretorrente, Parma","nan","2","65.0","nan","2"
"124","Appartamento Strada Carlo Pisacane, Centro Storico, Parma","1600.0","5","160.0","2","2"
"125","Trilocale ottimo stato, primo piano, San Leonardo, Parma","850.0","3","110.0","nan","2"
"126","Bilocale Strada Felice Cavallotti, Centro Storico, Parma","550.0","2","42.0","nan","4"
"127","Trilocale buono stato, primo piano, San Prospero, Parma","750.0","3","140.0","2","4"
"128","Appartamento via Alfredo Catalani, San Lazzaro, Parma","2200.0","5","195.0","2","4"
"129","Quadrilocale Strada Abbeveratoia, Ospedale - Volturno, Parma","700.0","4","95.0","nan","4"
"130","Quadrilocale Strada Abbeveratoia, Ospedale - Volturno, Parma","700.0","4","95.0","nan","4"
"131","Trilocale ottimo stato, terzo piano, Centro Storico, Parma","1500.0","3","160.0","2","4"
"132","Trilocale via Volturno 9, Ospedale - Volturno, Parma","700.0","3","80.0","nan","4"
"133","Bilocale ottimo stato, piano terra, San Leonardo, Parma","750.0","2","70.0","nan","4"
"134","Appartamento Strada Giuseppe Mazzini, Centro Storico, Parma","1600.0","5+","155.0","3","4"
"135","Bilocale via La Spezia, Ospedale - Volturno, Parma","550.0","2","45.0","nan","4"
"136","Bilocale ottimo stato, San Prospero, Parma","600.0","2","63.0","2","4"
"137","Quadrilocale viale toschi, Centro Storico, Parma","800.0","4","90.0","nan","4"
"138","Bilocale ottimo stato, piano terra, Stadio - Cittadella, Parma","500.0","2","50.0","nan","4"
"139","Quadrilocale via Emilio Lepido, San Lazzaro, Parma","325.0","4","105.0","nan","4"
"140","Trilocale Strada Antonio Zarotto, Stadio - Cittadella, Parma","680.0","3","75.0","nan","4"
"141","Monolocale Borgo San Giuseppe, Parco Ducale - Oltretorrente, Parma","620.0","nan","30.0","nan","4"
"142","Monolocale Borgo Carissimi 16, Centro Storico, Parma","550.0","nan","25.0","nan","4"
"143","Quadrilocale cittadella, Stadio - Cittadella, Parma","900.0","4","110.0","nan","4"
"144","Trilocale ottimo stato, terzo piano, Centro Storico, Parma","1200.0","3","140.0","2","4"
"145","Appartamento via Usiglio, San Lazzaro, Parma","1100.0","5","110.0","nan","4"
"146","Trilocale Borgo Pietro Cocconi 18, Parco Ducale - Oltretorrente, Parma","700.0","3","80.0","nan","4"
"147","Trilocale ottimo stato, piano rialzato, Villetta, Parma","1200.0","3","100.0","nan","4"
"148","Bilocale via torelli, Stadio - Cittadella, Parma","750.0","2","55.0","nan","4"
"149","Appartamento Strada Matteo Renato Imbriani 67, Parco Ducale - Oltretorrente, Parma","650.0","nan","75.0","nan","4"
"150","Bilocale buono stato, piano rialzato, Stadio - Cittadella, Parma","1000.0","2","75.0","nan","4"
"151","Open space Borgo Salnitrara 2, Centro Storico, Parma","350.0","nan","35.0","2","R"
"152","Bilocale piazzale Santa Croce, Parco Ducale - Oltretorrente, Parma","670.0","2","55.0","nan","R"
"153","Trilocale via La Spezia 25, Ospedale - Volturno, Parma","640.0","3","75.0","nan","R"
"154","Mansarda ottimo stato, 145 m², San Pancrazio, Parma","1150.0","4","145.0","3","R"
"155","Monolocale ottimo stato, primo piano, Botteghino - Pilastrello, Parma","470.0","nan","38.0","nan","R"
"156","Bilocale piazza Duomo, Centro Storico, Parma","550.0","2","60.0","nan","R"
"157","Bilocale ottimo stato, piano terra, Stadio - Cittadella, Parma","850.0","2","70.0","nan","R"
"158","Quadrilocale ottimo stato, terzo piano, Centro Storico, Parma","1200.0","4","145.0","nan","R"
"159","Appartamento Borgo Del Parmigianino, Centro Storico, Parma","1200.0","5+","178.0","nan","R"
"160","Trilocale ottimo stato, terzo piano, Centro Storico, Parma","1300.0","3","100.0","2","R"
"161","Bilocale via Alexander Fleming, Ospedale - Volturno, Parma","1000.0","2","60.0","nan","R"
"162","Trilocale viale Gorizia, Parco Ducale - Oltretorrente, Parma","550.0","3","55.0","nan","R"
"163","Villa bifamiliare via Francesco Zanetti, Ospedale - Volturno, Parma","2000.0","5+","340.0","3","R"
"164","Quadrilocale via Enrico Sartori, Pablo - Prati Bocchi, Parma","800.0","4","100.0","nan","R"
"165","Bilocale via Strela, Ospedale - Volturno, Parma","1000.0","2","60.0","nan","R"
"166","Mansarda via Umberto Benassi 7, Parco Ducale - Oltretorrente, Parma","570.0","2","51.0","nan","R"
"167","Bilocale viale Piacenza, Pablo - Prati Bocchi, Parma","850.0","2","40.0","nan","R"
"168","Bilocale Strada Nino Bixio 88, Parco Ducale - Oltretorrente, Parma","1400.0","2","65.0","nan","R"
"169","Bilocale Strada Ospizi Civili, Centro Storico, Parma","1350.0","2","40.0","nan","R"
"170","Quadrilocale viale dei Mille, Ospedale - Volturno, Parma","1400.0","4","150.0","2","R"
"171","Bilocale ospedale maggiore, Villetta, Parma","670.0","2","55.0","nan","R"
"172","Appartamento Borgo della Posta, Centro Storico, Parma","1570.0","5","130.0","nan","R"
"173","Trilocale via Emilia Est 21, San Lazzaro, Parma","680.0","3","90.0","nan","R"
"174","Trilocale via Volturno, Ospedale - Volturno, Parma","550.0","3","75.0","nan","R"
"175","Bilocale via Fratelli Amoretti, San Pancrazio, Parma","850.0","2","55.0","nan","R"
"176","Monolocale via Emilia Est, San Lazzaro, Parma","350.0","nan","40.0","nan","2"
"177","Trilocale ottimo stato, primo piano, Centro Storico, Parma","1300.0","3","110.0","2","2"
"178","Trilocale via Montebello, Stadio - Cittadella, Parma","1000.0","3","70.0","nan","2"
"179","Trilocale ottimo stato, terzo piano, Centro Storico, Parma","1500.0","3","150.0","2","2"
"180","Bilocale Strada Costituente, Parco Ducale - Oltretorrente, Parma","750.0","2","63.0","nan","2"
"181","Quadrilocale via Gerolamo Cardano, Ospedale - Volturno, Parma","900.0","4","85.0","nan","2"
"182","Monolocale viale Arturo Toscanini, Centro Storico, Parma","390.0","nan","40.0","nan","2"
"183","Monolocale via Xx Settembre 6, Centro Storico, Parma","1200.0","nan","50.0","nan","2"
"184","Bilocale viale dei Mille, Ospedale - Volturno, Parma","500.0","2","60.0","nan","2"
"185","Monolocale viale Dei Mille, Ospedale - Volturno, Parma","700.0","nan","30.0","nan","2"
"186","Bilocale via Emilia Ovest, Pablo - Prati Bocchi, Parma","450.0","2","50.0","nan","2"
"187","Bilocale via Alexander Fleming, Ospedale - Volturno, Parma","1200.0","2","45.0","nan","2"
"188","Bilocale via Antonio Gramsci, Pablo - Prati Bocchi, Parma","1000.0","2","40.0","nan","2"
"189","Bilocale Strada Navetta, Montanara - Cinghio, Parma","650.0","2","65.0","nan","2"
"190","Villa unifamiliare Strada Langhirano, Montanara - Cinghio, Parma","2100.0","5+","460.0","3","2"
"191","Appartamento via Borghesi, Centro Storico, Parma","1850.0","5","160.0","nan","2"
"192","Bilocale oltretorrente, Parco Ducale - Oltretorrente, Parma","650.0","2","60.0","nan","2"
"193","Bilocale piazzale Daniele Bertozzi, Parco Ducale - Oltretorrente, Parma","1000.0","2","80.0","nan","2"
"194","Monolocale Strada Antonio Zarotto, San Lazzaro, Parma","900.0","nan","35.0","nan","2"
"195","Trilocale 100 m², San Pancrazio, Parma","1150.0","3","100.0","2","2"
"196","Trilocale piazzale San Francesco, Centro Storico, Parma","1200.0","3","75.0","nan","2"
"197","Monolocale piazza garibaldi, Centro Storico, Parma","550.0","nan","40.0","nan","2"
"198","Quadrilocale ottimo stato, secondo piano, Centro Storico, Parma","1100.0","4","137.0","nan","2"
"199","Trilocale Borgo Giacomo Tommasini, Centro Storico, Parma","1000.0","3","100.0","2","2"
"200","Trilocale Borgo Felino, Centro Storico, Parma","1500.0","3","140.0","nan","2"
"201","Trilocale buono stato, primo piano, Montanara - Cinghio, Parma","650.0","3","93.0","nan","1"
"202","Quadrilocale ottimo stato, secondo piano, Centro Storico, Parma","nan","4","300.0","3","1"
"203","Bilocale Strada Felice Cavallotti, Centro Storico, Parma","550.0","2","45.0","nan","1"
"204","Bilocale buono stato, piano terra, Parco Ducale - Oltretorrente, Parma","500.0","2","50.0","nan","1"
"205","Mansarda via Luigi Musini 13, Ospedale - Volturno, Parma","500.0","nan","35.0","nan","1"
"206","Bilocale via Cesare Sanguinetti, Ospedale - Volturno, Parma","500.0","2","47.0","nan","1"
"207","Monolocale ottimo stato, primo piano, San Leonardo, Parma","500.0","nan","20.0","nan","1"
"208","Quadrilocale buono stato, primo piano, Centro Storico, Parma","nan","4","260.0","3","1"
"209","Bilocale strada del consorzio 8, Centro Storico, Parma","1400.0","2","60.0","nan","1"
"210","Quadrilocale via Enrico Sartori, Pablo - Prati Bocchi, Parma","800.0","4","100.0","nan","1"
"211","Quadrilocale via Gerolamo Cardano, Ospedale - Volturno, Parma","900.0","4","85.0","nan","1"
"212","Bilocale via Emilia Ovest, Pablo - Prati Bocchi, Parma","350.0","2","10.0","nan","1"
"213","Trilocale via Martiri di Cassio, Stadio - Cittadella, Parma","1200.0","3","90.0","nan","1"
"214","Trilocale Strada Due Castagne, Campus - Gaione, Parma","850.0","3","60.0","nan","1"
"215","Appartamento viale Caprera, Villetta, Parma","1250.0","5","130.0","nan","1"
"216","Bilocale ottimo stato, primo piano, Centro Storico, Parma","1250.0","2","90.0","2","1"
"217","Bilocale ottimo stato, secondo piano, San Lazzaro, Parma","750.0","2","65.0","nan","1"
"218","Monolocale ottimo stato, quarto piano, Centro Storico, Parma","550.0","nan","28.0","nan","1"
"219","Mansarda Strada della Repubblica, Centro Storico, Parma","750.0","2","45.0","nan","1"
"220","Quadrilocale Borgo Parente, Parco Ducale - Oltretorrente, Parma","900.0","4","110.0","nan","1"
"221","Monolocale Strada Nino Bixio, Parco Ducale - Oltretorrente, Parma","480.0","nan","25.0","nan","1"
"222","Appartamento ottimo stato, San Lazzaro, Parma","nan","5+","320.0","3+","1"
"223","Bilocale ottimo stato, Centro Storico, Parma","750.0","2","45.0","nan","1"
"224","Bilocale piazza Giuseppe Garibaldi, Centro Storico, Parma","1200.0","2","50.0","nan","1"
"225","Bilocale Strada Farnesiana, Baganzola - Aeroporto, Parma","400.0","2","60.0","nan","1"
"226","Monolocale Strada Antonio Zarotto, San Lazzaro, Parma","1100.0","nan","35.0","nan","3"
"227","Monolocale Strada Abbeveratoia, Ospedale - Volturno, Parma","1200.0","nan","40.0","nan","3"
"228","Bilocale via Fratelli Amoretti, San Pancrazio, Parma","850.0","2","55.0","nan","3"
"229","Villa unifamiliare, ottimo stato, 150 m², Botteghino - Pilastrello, Parma","1350.0","5","150.0","3","3"
"230","Appartamento Strada Costituente, Parco Ducale - Oltretorrente, Parma","700.0","nan","63.0","nan","3"
"231","Monolocale Borgo Riccio, Centro Storico, Parma","800.0","nan","25.0","nan","3"
"232","Bilocale ottimo stato, secondo piano, San Leonardo, Parma","600.0","2","55.0","nan","3"
"233","Trilocale Borgo del Carbone, Centro Storico, Parma","1250.0","3","90.0","nan","3"
"234","Monolocale Strada Antonio Zarotto, San Lazzaro, Parma","1050.0","nan","35.0","nan","3"
"235","Trilocale via Zanardi, Parma","700.0","3","85.0","nan","3"
"236","Monolocale via D'azeglio, Parco Ducale - Oltretorrente, Parma","450.0","nan","30.0","nan","3"
"237","Palazzo - Edificio 3 piani, nuovo, Paradigna - Centro Torri, Parma","nan","5+","1.2","3+","3"
"238","Appartamento via dei Farnese, Parco Ducale - Oltretorrente, Parma","1350.0","5","150.0","2","3"
"239","Monolocale Strada Massimo d'Azeglio, Parco Ducale - Oltretorrente, Parma","400.0","nan","35.0","nan","3"
"240","Appartamento via Bixio 58, Parco Ducale - Oltretorrente, Parma","900.0","nan","40.0","nan","3"
"241","Trilocale ottimo stato, terzo piano, Stadio - Cittadella, Parma","1200.0","3","120.0","2","3"
"242","Quadrilocale ottimo stato, Centro Storico, Parma","1700.0","4","160.0","2","3"
"243","Quadrilocale terzo piano, Centro Storico, Parma","1500.0","4","140.0","2","3"
"244","Trilocale ottimo stato, primo piano, Parma","1400.0","3","60.0","nan","3"
"245","Villa unifamiliare, ottimo stato, 420 m², Parma","3000.0","5","420.0","nan","3"
"246","Trilocale ottimo stato, piano terra, Stadio - Cittadella, Parma","1000.0","3","70.0","nan","3"
"247","Bilocale quarto piano, Centro Storico, Parma","nan","2","95.0","nan","3"
"248","Quadrilocale ottimo stato, primo piano, Centro Storico, Parma","nan","4","230.0","3","3"
"249","Appartamento 35 m², Parma","nan","nan","35.0","nan","3"
"250","Appartamento ottimo stato, Centro Storico, Parma","1650.0","5","160.0","nan","3"
"251","Trilocale viale dei Mille 112, Ospedale - Volturno, Parma","1200.0","3","80.0","2","1"
"252","Quadrilocale Strada Bassa dei Folli, Stadio - Cittadella, Parma","1100.0","4","100.0","nan","1"
"253","Trilocale viale Duca Alessandro 56/2, Stadio - Cittadella, Parma","1150.0","3","100.0","nan","1"
"254","Appartamento via Gaetano Callani, San Lazzaro, Parma","430.0","5+","120.0","nan","1"
"255","Bilocale via Tito Zaniboni 9, Ospedale - Volturno, Parma","800.0","2","60.0","nan","1"
"256","Quadrilocale via Eugenio Ravà, Ospedale - Volturno, Parma","720.0","4","100.0","nan","1"
"257","Bilocale via Alessandro Levi 14/1, Campus - Gaione, Parma","850.0","2","60.0","nan","1"
"258","Appartamento Stradello San Girolamo 8, Centro Storico, Parma","1500.0","5+","165.0","2","1"
"259","Bilocale via Verona 38, San Leonardo, Parma","900.0","2","47.0","nan","1"
"260","Mansarda piazzale San Lorenzo 23A, Centro Storico, Parma","800.0","2","46.0","nan","1"
"261","Bilocale Borgo dei Grassani 2, Parco Ducale - Oltretorrente, Parma","880.0","2","55.0","nan","1"
"262","Bilocale Strada Baganzola 101, Baganzola - Aeroporto, Parma","600.0","2","55.0","nan","1"
"263","Trilocale viale Biagio Pelacani 20, Stadio - Cittadella, Parma","1200.0","3","70.0","nan","1"
"264","Mansarda via Venezia, San Leonardo, Parma","1000.0","2","48.0","nan","1"
"265","Bilocale vicolo Scacchini 13, Centro Storico, Parma","900.0","2","54.0","nan","1"
"266","Monolocale Strada Abbeveratoia 21, Ospedale - Volturno, Parma","950.0","nan","40.0","nan","1"
"267","Quadrilocale via Claudio Monteverdi 2, San Lazzaro, Parma","700.0","4","110.0","nan","1"
"268","Bilocale Strada Camillo Benso di Cavour 6A, Centro Storico, Parma","750.0","2","54.0","nan","1"
"269","Monolocale Borgo Giacomo Tommasini 17, Centro Storico, Parma","350.0","nan","30.0","nan","1"
"270","Trilocale piazzale Generale Carlo Alberto Dalla Chiesa 7, San Leonardo, Parma","300.0","3","101.0","nan","1"
"271","Monolocale via Strela 10, Ospedale - Volturno, Parma","1000.0","nan","60.0","nan","1"
"272","Bilocale Strada Ospizi Civili, Centro Storico, Parma","1350.0","2","35.0","nan","1"
"273","Trilocale via Gerolamo Cardano 2, Ospedale - Volturno, Parma","900.0","3","85.0","nan","1"
