"Index","Title description","Price","N_rooms","Surface","N_toilettes","Floor"
"274","Mansarda via Massimo D'Azeglio 7, Parco Ducale - Oltretorrente, Parma","1300.0","nan","75.0","nan","1"
"275","Monolocale Borgo Riccio da Parma, Centro Storico, Parma","650.0","nan","20.0","nan","1"
"276","Trilocale viale Caprera, Parco Ducale - Oltretorrente, Parma","1200.0","3","100.0","nan","3"
"277","Appartamento via corso Corsi 56, Centro Storico, Parma","1200.0","nan","26.0","nan","3"
"278","Appartamento viale Piacenza 44, Pablo - Prati Bocchi, Parma","1600.0","5+","140.0","2","3"
"279","Monolocale Borgo Paglia 23, Parco Ducale - Oltretorrente, Parma","1100.0","nan","50.0","nan","3"
